"Brand","Model","Model Code","Codename","OEM ID","Brief","Released","Announced","Hardware Designer","Manufacturer","Predecessor Model","General Extras","Device Category","List of Additional Features","Width (mm)","Width (inch)","Height (mm)","Height (inch)","Depth (mm)","Depth (inches)","Typical depth (mm)","Bounding Volume (ccm)","Mass (g)","Mass (ounces)","Platform","Operating System","Operating System Additional Information","Operating System Kernel Version","Software Extras","CPU Clock (MHz)","CPU","RAM Type","RAM Databus Clock (MHz)","RAM Capacity (MiB RAM)","Accessible RAM space (MiB user accessible RAM)","RAM IC","Non-volatile Memory Type","Non-volatile Memory Interface","Non-volatile Memory Databus Clock (MHz)","Non-volatile Memory Capacity (MiB non-volatile)","Non-volatile Memory IC","Non-volatile user storage (MiB free user storage)","Secondary Non-volatile Memory Type","Secondary Non-volatile Memory Capacity (sec. ROM)","Secondary non-volatile user storage (MiB free user storage)","Hard Disk Capacity (GB HDD)","Display Notch (-notch)","Display Hole (-hole)","Display Diagonal (mm)","Display Diagonal (inch)","Resolution","Number of pixels (pixels)","Display Width (mm)","Display Width (inch)","Display Height (mm)","Display Height (inch)","Horizontal Full Bezel Width (mm)","Display Area (square millimeter)","Display Area Utilization (%)","Pixel Size (mm/pixel)","Pixel Density (PPI)","Display Type","Display Subtype","Display Color Depth (bit/pixel)","Number of Display Scales","Display Dynamic Range Depth (bit/pixel)","Display Illumination","Display Light Reflection Mode","Display Subpixel Scheme","Display Refresh Rate (Hz)","Scratch Resistant Screen","Display Module","Secondary Display Diagonal (mm)","Secondary Display Diagonal (inch)","Secondary Display Resolution","Secondary Number of pixels (pixels)","Secondary Horizontal Display Size (mm)","Secondary Horizontal Display Size	 (inch)","Secondary Vertical Display Size (mm)","Secondary Vertical Display Size (inches)","Secondary Display Area (square millimeter)","Secondary Display Pixel Size (mm/pixel)","Secondary Display Pixel Density (dot pitch) (PPI)","Secondary Display Type","Secondary Display Subtype","Secondary Display Color Depth (bit/pixel)","Secondary Number of Display Colors/Scales","Secondary Display Dyn. Range Depth (bit/pixel)","Secondary Display Illumination","Secondary Display Light Reflection Mode","Secondary Display Subpixel Scheme","Scratch Resistant Sec. Screen","Graphical Controller","Dedicated Graphics Memory (MiB)","GPU Clock (MHz)","Frame Buffer (KiB)","A/V Out","A/V Out Connector","A/V In","A/V Out Max. Resolution","A/V In Connector","Audio Channel(s)","Audio Controller","A/D Converter Nominal Resolution (bit quantization )","A/D Sampling Frequency (Hz)","Microphone(s)","Microphone Input","D/A Converter Nominal Resolution (bit quantization)","D/A Holding Frequency (Hz)","Loudspeaker(s)","Loudspeaker Power (W)","Audio Output","Supported Cellular Bands","Supported Cellular Data Links","SIM Card Slot","Cellular Antenna","Call Alert Sound (-chord melody)","Hearing Aid Compatibility (HAC)","Complementary Phone Services","Cellular Controller","SAR (head) (W/kg)","SAR measurement method (head)","SAR measurement band (head)","SAR (body) (W/kg)","SAR measurement method (body)","SAR measurement band (body)","SAR (hotspot) (W/kg)","SAR measurement method (hotspot)","SAR measurement band (hotspot)","2nd highest SAR (head) (W/kg)","2nd highest SAR measurement method (head)","2nd highest SAR measurement band (head)","2nd highest SAR (body) (W/kg)","2nd highest SAR measurement method (body)","2nd highest SAR measurement band (body)","Dual Cellular Network Operation","Sec. Supported Cellular Networks","Sec. Supported Cellular Data Links","Sec. SIM Card Slot","Sec. Cellular Antenna","Sec. Phone Controller IC","Touchscreen Type","Touchscreen Simultaneous Touch Points","Touchscreen Sampling rate (Hz)","Touch Surface Type","Touch Surface Simultaneous Touch Points","Keyboard","Keyboard Backlight","Number of keys","Secondary Keyboard","Secondary Keyboard Backlight","Number of secondary keys","Directional Pad","Scroll Wheel","Expansion Interfaces","USB","USB Speed Rate","USB Services","USB Connector","Max. Charging Power (W)","USB2","USB2 Speed Rate","USB2 Services","USB2 connector","USB3","USB3 Speed Rate","USB3 Services","USB3 connector","Bluetooth","Bluetooth profiles","Bluetooth Controller IC","Wireless LAN","Wireless Services","WLAN Controller IC","Wireless MAN","NFC","IR","Analog TV receiver","Analog TV Antenna","FM Radio Receiver","FM Radio Antenna","FM Radio Transmitter","Digital Media Broadcast","Digital Media Broadcast Antenna","Supported GPS protocol(s)","Parallel GPS Channels","GPS Antenna","Complementary GPS Services","Supported GLONASS protocol(s)","Supported Galileo service(s)","Supported BeiDou system","Navigation Controller","Camera Placement","Camera Module","Camera Image Sensor","Image Sensor Format","Image Sensor Pixel Size (micrometer)","Camera Resolution (pixel)","Camera Number of pixels (MP)","Aperture W","Aperture T","Zoom (x optical zoom)","Digital Zoom (x digital zoom)","Focus","Min. Equiv. Focal Length (mm)","Minimal Focal Length (mm)","Recordable Image Formats","Video Recording (pixel)","Camcorder Frame Rate (fps)","Recordable Video Formats","Flash","Camera Extra Functions","Aux. Camera Module","Aux. Camera Image Sensor","Aux. Cam. Image Sensor Format","Aux. Cam. Image Sensor Pixel Size (micrometer)","Aux. Camera Number of Pixels (MP)","Aux. Camera Aperture (W)","Aux. Cam. Min. Equiv. Focal Length (mm)","Aux. Camera Focus","Aux. Camera Extra Functions","Aux. 2 Camera Image Sensor","Aux. 2 Cam. Image Sensor Pixel Size (micrometer)","Aux. 2 Cam. Image Sensor Format","Aux. 2 Camera Number of Pixels (MP)","Aux. 2 Camera Aperture (W)","Aux. 2 Cam. Min. Equiv. Focal Length (mm)","Aux. 2 Camera Focus","Aux. 2 Camera Extra Functions","Aux. 3 Camera Image Sensor","Aux. 3 Cam. Image Sensor Pixel Size (micrometer)","Aux. 3 Camera Number of Pixels (MP)","Aux. 3 Camera Aperture (W)","Aux. 3 Cam. Min. Equiv. Focal Length (mm)","Aux. 3 Camera Focus","Aux. 3 Camera Extra Functions","Aux. 4 Camera Image Sensor","Aux. 4 Camera Number of Pixels (MP)","Aux. 4 Cam. Image Sensor Pixel Size (micrometer)","Aux. 4 Camera Aperture (W)","Aux. 4 Camera Focus","Aux. 4 Camera Extra Functions","Secondary Camera Placement","Secondary Camera Module","Secondary Camera Sensor","Secondary Image Sensor Format","Secondary Image Sensor Pixel Size (micrometer)","Secondary Camera Resolution (pixel)","Secondary Camera Number of pixels (MP)","Secondary Aperture (W)","Secondary Camera Focus","Secondary Min. Equiv. Focal Length (mm)","Secondary Recordable Image Formats","Secondary Video Recording (pixel)","Secondary Camcorder Frame Rate (fps)","Secondary Recordable Video Formats","Sec. Built-in Flash","Secondary Camera Extra Functions","Sec. Aux. Cam. Image Sensor","Sec. Aux. Image Sensor Pixel Size (micrometer)","Sec. Aux. Camera Number of Pixels  (MP)","Sec. Aux. Cam. Aperture (W)","Sec. Aux. 2 Cam. Image Sensor","Sec. Aux. 2 Camera Number of Pixels (MP)","Sec. Aux. 2 Cam. Aperture (W)","Built-in compass","Built-in accelerometer","Built-in gyroscope","Additional sensors","Built-in Barcode Scanner","Protection from solid materials","Protection from liquids","Protection against mechanical impacts (cm)","Immersion into liquids time limit (min)","Immersion into liquids (depth limit) (cm)","Military Standard Compliance (MIL-STD)","Battery","Battery Build","Battery Cells in Parallel","Number of Battery Cells (-cell)","Nominal Cell Voltage (1st cell) (Volts)","Nominal Cell Capacity (1st cell) (mAh cell)","Nominal Battery Voltage (2nd cell) (Volts)","Nominal Cell Capacity (2nd cell) (mAh cell)","Nominal Battery Voltage (Volts)","Nominal Battery Capacity (mAh battery)","Nominal Battery Energy (Wh)","Estimated Battery Life (hours)","Estimated Average Current (mA)","Standby Time (hours)","Average Standby Current  (mA)","Talk Time (hours)","Average Current Talking (mA)","Power Supply Controller IC","Wireless Charging","Max. Wireless Charging Power (W)","Market Countries","Market Regions","Mobile Operator","Price","Price Currency","Image","Data Integrity","Added","ID"
"Xiaomi","Mi 10 Lite Zoom 5G Dual SIM TD-LTE CN 64GB","M2002J9C","Xiaomi VanGogh","","Mi 10 Lite Zoom Edition carries on the outstanding legacy of the Mi 10 series while being the first Xiaomi device to adopt a periscope telephoto camera.","2020 May 4","2020 Apr 27","Xiaomi","Foxconn","","Haptic touch feedback","Smartphone","720p 960 fps super slow motion video recording, vapor chamber liquid cooling, HDR10, Mi Turbo, Game Turbo 2.0","74.77","2.94","164.02","6.46","7.98","0.31","","97.9","192","6.77","Android","Google Android 10 (Q)","MIUI 11","","Voice Command, Navigation software, Augmented Reality (AR), Intelligent personal assistant, Face Recognition","2400","Qualcomm Snapdragon 765G 5G SM7250-AB (Lito)","LPDDR4x SDRAM","2133","6144","","","Flash EEPROM","UFS 2.1","","61035","","","No","","","","1","","166.9","6.6","1080x2400","2592000","68.49","2.7","152.2","5.99","6.28","10424.1","85","0.06342","401","AM-OLED","No","24","16.8M","10","Self-illuminating","Any","Any","","Gorilla Glass 5","","","","","","","","","","","","","No","No","","","","No","No","No","No","Qualcomm Adreno 620","","625","","No","No","No","No","No","stereo","","","","stereo","No","","","mono","","3.5mm","GSM850, GSM900, GSM1800, GSM1900, CDMA800 (BC0), UMTS850 (B5), UMTS900 (B8), UMTS1900 (B2), UMTS2100 (B1), LTE2100 (B1), LTE1700/2100 (B4), LTE850 (B5), LTE1800 (B3), LTE2600 (B7), LTE1900 (B2), LTE900 (B8), TD-LTE2500 (B41), TD-LTE2600 (B38), TD-LTE2300 (B40), TD-LTE1900 (B39), TD-LTE2000 (B34), TD-NR2500 (N41), TD-NR3500 (N78), TD-NR4700 (N79), NR2100 (N1)","GPRS, EDGE, UMTS, HSDPA, HSPA+ 21.1, HSPA+ 42.2, DC-HSDPA 42.2, HSUPA, HSUPA 5.8, cdmaOne, CDMA2000 1x, CDMA2000 1xEV-DO, CDMA2000 1xEV-DO Rev A, LTE, LTE 100/50, LTE 150/50, LTE 300/50, LTE 600/50, LTE 1000/100, NR 2600","Nano-SIM (4FF)","Internal antenna","64","No","Voice transmission, Voice speaker, Vibrate, Speakerphone, ANC, HD Voice, VoLTE","Qualcomm SM7250","0","No","No","0","No","No","0","No","No","0","No","No","0","No","No","Dual standby","GSM850, GSM900, GSM1800, GSM1900, CDMA800 (BC0), UMTS850 (B5), UMTS900 (B8), UMTS1900 (B2), UMTS2100 (B1), LTE2100 (B1), LTE1700/2100 (B4), LTE850 (B5), LTE1800 (B3), LTE2600 (B7), LTE1900 (B2), LTE900 (B8), TD-LTE2500 (B41), TD-LTE2600 (B38), TD-LTE2300 (B40), TD-LTE1900 (B39), TD-LTE2000 (B34)","GPRS, EDGE, UMTS, HSDPA, HSPA+ 21.1, HSPA+ 42.2, DC-HSDPA 42.2, HSUPA, HSUPA 5.8, cdmaOne, CDMA2000 1x, CDMA2000 1xEV-DO, CDMA2000 1xEV-DO Rev A, LTE, LTE 100/50, LTE 150/50, LTE 300/50, LTE 600/50, LTE 1000/100","Nano-SIM (4FF)","Internal antenna","Qualcomm SM7250","Capacitive multi-touch","10-point","180","No","No","No","No","","No","No","","No","No","No","USB 2.0","USB HS (480 Mbps)","USB Host, USB OTG 1.3, USB OTG 2.0, USB PD, USB charging, USB PD 2.0, USB PD 3.0, USB fast charging","USB C reversible","20","No","No","No","No","No","No","No","No","Bluetooth 5.1","A2DP, AVRCP, GAVDP, HID, HSP, OPP, PAN, PBA, A2DP aptX, MAP, A2DP aptX HD","","802.11a, 802.11b, 802.11g, 802.11n, 802.11ac","Wi-Fi Direct, Wi-Fi Tethering, WiDi, Wi-Fi Calling","","No","NFC A, NFC B","Any","No","No","FM radio (76-108 MHz) with RDS","Proprietary headset","No","No","No","GPS","","Internal antenna","A-GPS, QuickGPS, Dual-frequency GPS, Geotagging, Simultaneous GPS, QZSS","Any","Open access, Commercial","BeiDou-1, BeiDou-2","Qualcomm SM7250","Rear","","BSI CMOS","1/2.00","0.8","8000x6000","48.0","f/1.79","","5","10","PD AF","","","JPG, HEIF","3840x2160","30","MPEG4, HEVC","dual LED","Macro mode, EIS (video), Face detection, Smile detection, Touch focus, Panorama Photo, HDR photo, HDR video, Red-eye reduction, Slow motion video, Face tagging, Face retouch, Face retouch (video), Burst mode, Intelligent scene detection, Pixel unification","","BSI CMOS","1/4.00","1.12","8.0","f/2.20","122","No","OIS, Panorama Photo, HDR photo, Burst mode, Intelligent scene detection","BSI CMOS","0","","8.0","f/2.20","15","No","Face detection, Smile detection, Panorama Photo, HDR photo, Face tagging, Face retouch, Burst mode, Intelligent scene detection","CMOS","0","1.9","f/2.40","","No","Macro mode, Burst mode","No","0.0","0","","No","No","Front","","BSI CMOS","","0","4608x3456","15.9","","No","","JPG","1920x1080","30","3GP","No","Face detection, Smile detection, Panorama Photo, HDR photo, HDR video, Face tagging, Face retouch, Face retouch (video), Burst mode, Intelligent scene detection","No","0","0.0","","No","0.0","","Any","3D","3D","L sensor, P sensor, In-screen FP sensor","No","Any","Any","","","","No","Li-ion polymer (LiPo)","built-in","","1","0","4160","0","","0","4160","0","0","","","","0","","","No","0","China","Asia","","2099","CNY","xiaomi_mi_10_lite_5g_2.jpg","Final","2021-05-04 15:21","18293"
"Oppo","Realme C17 2020 Dual SIM TD-LTE V2 MY 256GB","RMX2101","BBK 2101","","When the battery level is low, a radical power-saving mode can be turned on to extend the battery life. V2 band config, 6 / 256 GB variant","2020 Sep 22","2020 Sep","BBK Electronics","BBK Electronics","","Haptic touch feedback","Smartphone","","75.5","2.97","164.1","6.46","8.5","0.33","","105.3","188","6.63","Android","Google Android 10 (Q)","realme UI 1.0","","Voice Command, Navigation software, Intelligent personal assistant, Face Recognition","1800","Qualcomm Snapdragon 460 SM4250-AA","LPDDR4x SDRAM","1804","6144","5611","","Flash EEPROM","UFS 2.1","","244140","","","No","","","","","1","165.1","6.5","720x1600","1152000","67.75","2.67","150.56","5.93","7.75","10200.5","82.3","0.0941","270","Color IPS TFT LCD","No","24","16.8M","8","LED","Any","Any","90","Any","","","","","","","","","","","","","No","No","","","","No","No","No","No","Qualcomm Adreno 610","","600","","No","No","No","No","No","stereo","","","","stereo","No","","","mono","","3.5mm","GSM850, GSM900, GSM1800, GSM1900, UMTS850 (B5), UMTS900 (B8), UMTS2100 (B1), LTE2100 (B1), LTE850 (B5), LTE1800 (B3), LTE900 (B8), LTE800 (B20), TD-LTE2500 (B41), TD-LTE2600 (B38), TD-LTE2300 (B40), LTE700 (B28)","GPRS, GPRS C12, GPRS MSC33, EDGE, EDGE MSC12, EDGE MSC33, UMTS, HSDPA, HSPA+ 21.1, DC-HSDPA 42.2, HSUPA, HSUPA 5.8, LTE, LTE 100/50, LTE 150/50, LTE 300/50","Nano-SIM (4FF)","Internal antenna","64","M4, T4","Voice transmission, Voice speaker, Vibrate, Speakerphone, ANC, HD Voice, VoLTE","Qualcomm SM4250","0","No","No","0","No","No","0","No","No","0","No","No","0","No","No","Dual standby","GSM850, GSM900, GSM1800, GSM1900, UMTS850 (B5), UMTS900 (B8), UMTS2100 (B1), LTE2100 (B1), LTE850 (B5), LTE1800 (B3), LTE900 (B8), LTE800 (B20), TD-LTE2500 (B41), TD-LTE2600 (B38), TD-LTE2300 (B40), LTE700 (B28)","GPRS, GPRS C12, GPRS MSC33, EDGE, EDGE MSC12, EDGE MSC33, UMTS, HSDPA, HSPA+ 21.1, DC-HSDPA 42.2, HSUPA, HSUPA 5.8, LTE, LTE 100/50, LTE 150/50, LTE 300/50","Nano-SIM (4FF)","Internal antenna","Qualcomm SM4250","Capacitive multi-touch","Any","","No","No","No","No","","No","No","","No","No","microSD, microSDHC, TransFlash, microSDXC","USB 2.0","USB HS (480 Mbps)","USB Host, USB OTG 1.3, USB PD, USB charging, USB fast charging","USB C reversible","18","No","No","No","No","No","No","No","No","Bluetooth 5.0","A2DP, AVRCP, GAVDP, HFP, HID, HSP, OPP, PAN, PBA, SPP, A2DP aptX, MAP","","802.11a, 802.11b, 802.11g, 802.11n, 802.11ac","Wi-Fi Direct, Wi-Fi Tethering, Wi-Fi Calling","","No","No","No","No","No","FM radio (76-108 MHz) with RDS","Proprietary headset","No","No","No","GPS","","Internal antenna","A-GPS, QuickGPS, Geotagging, Simultaneous GPS","Any","No","BeiDou-2","Qualcomm SM4250 iZat","Rear","","BSI CMOS","","0","4160x3120","13.0","f/2.20","","1","0","PD AF","","","JPG","1920x1080","30","MPEG4","single LED","Face detection, Smile detection, Touch focus, Panorama Photo, HDR photo, Red-eye reduction, Face tagging, Face retouch, Burst mode","","CMOS","","1.12","8.0","f/2.20","","No","Macro mode, Burst mode","CMOS","1.75","","1.9","f/2.40","","No","Macro mode, Burst mode","Mono CMOS","0","1.9","f/2.40","","No","No","No","0.0","0","","No","No","Front","","CMOS","","1.12","3264x2448","8.0","f/2.00","No","","JPG","1920x1080","30","MPEG4","No","Face detection, Smile detection, Panorama Photo, HDR photo, Face tagging, Face retouch, Burst mode","No","0","0.0","","No","0.0","","Any","Any","No","L sensor, P sensor, FP sensor","No","Any","Any","","","","No","Li-ion","built-in","","1","3.87","5000","0","","3.87","5000","19.35","35.7","140","816","6","0","","","No","0","Malaysia","Asia, Southeast Asia","","899","MYR","oppo_c17_2020.jpg","Final","2020-12-13 21:41","17813"
"Sony","Xperia Pro 5G UW 2021 Dual SIM TD-LTE JP 512GB","XQ-AQ52","Sony PDX-204","","Thanks to HDMI connectivity you can connect the Xperia PRO to your camera, making a range of tasks easier, from monitoring images to live video streaming using the speed of 5G. Dual SIM unlocked variant for Japan","2021 Feb 9","2021 Jan 27","Sony","Sony","","Haptic touch feedback","Smartphone","ZEISS optics, 3D iToF sensor, HDR10 support, DCI-P3, DSEE HX, LDAC, Dolby Atmos sound, RGB-IR sensor, 5-axis OIS (SteadyShot), 3D Creator, Eye autofocus, predictive dual-pixel PDAF (main, wide-angle, telephoto), 20 fps Autofocus / Auto Exposure, PS4 Remote Play, 1080p 120 fps slow-motion video recording","76.2","3","170.2","6.7","10.16","0.4","","131.8","225","7.94","Android","Google Android 10 (Q)","","","Voice Command, Navigation software, Augmented Reality (AR), Intelligent personal assistant, Face Recognition","2842","Qualcomm Snapdragon 865 5G SM8250 (Kona)","LPDDR4x SDRAM","","12288","","","Flash EEPROM","Any","","488281","","","No","","","","","","165.1","6.5","1644x3840","6312960","64.98","2.56","151.78","5.98","11.22","9862.2","76","0.03952","643","AM-OLED","No","30","1073.7M","10","Self-illuminating","Any","Any","","Gorilla Glass 6","","","","","","","","","","","","","No","No","","","","No","No","No","No","Qualcomm Adreno 650","","587","","DisplayPort","USB Type-C reversible","HDMI","3840x2160 (2160p)","HDMI D Micro","stereo","","","","stereo","No","24","192000","stereo","","3.5mm","GSM850, GSM900, GSM1800, GSM1900, UMTS800 (B6), UMTS850 (B5), UMTS900 (B8), UMTS1700/2100 (B4), UMTS1900 (B2), UMTS2100 (B1), UMTS800 (B19), LTE2100 (B1), LTE700 (B17), LTE700 (B13), LTE1700/2100 (B4), LTE850 (B5), LTE1800 (B3), LTE2600 (B7), LTE1900 (B2), LTE1500 (B11), LTE800 (B18), LTE900 (B8), LTE800 (B20), LTE1900 (B25), LTE700 (B12), LTE850 (B26), LTE800 (B19), LTE1500 (B21), TD-LTE2500 (B41), TD-LTE2600 (B38), TD-LTE2300 (B40), TD-LTE1900 (B39), LTE700 (B28), LTE700 (B29), TD-LTE3500 (B42), LTE1500 (B32), LTE1700/2100 (B66), TD-LTE5900  (B46), TD-LTE3600  (B48), TD-LTE2000 (B34), TD-NR3700 (N77), TD-NR3500 (N78), TD-NR4700 (N79), TD-NR28G (N257)","GPRS, EDGE, EDGE MSC33, UMTS, HSDPA, HSDPA 14.4, HSPA+ 21.1, DC-HSDPA 42.2, HSUPA, HSUPA 5.8, LTE, LTE 50/25, LTE 75/25, LTE 100/50, LTE 150/50, LTE 300/75, LTE 300/50, LTE 300/100, LTE 450/50, LTE 450/100, LTE 600/50, LTE 600/100, LTE 400/150, LTE 1000/100, LTE 1600, LTE 1200/200, NR 2600, NR 3700, NR 1500","Nano-SIM (4FF)","Internal antenna","64","No","Voice transmission, Voice speaker, Vibrate, Speakerphone, ANC, HD Voice, VoLTE","Qualcomm Snapdragon X55","0","No","No","0","No","No","0","No","No","0","No","No","0","No","No","Dual standby","GSM850, GSM900, GSM1800, GSM1900, UMTS800 (B6), UMTS850 (B5), UMTS900 (B8), UMTS1700/2100 (B4), UMTS1900 (B2), UMTS2100 (B1), UMTS800 (B19), LTE2100 (B1), LTE700 (B17), LTE700 (B13), LTE1700/2100 (B4), LTE850 (B5), LTE1800 (B3), LTE2600 (B7), LTE1900 (B2), LTE1500 (B11), LTE800 (B18), LTE900 (B8), LTE800 (B20), LTE1900 (B25), LTE700 (B12), LTE850 (B26), LTE800 (B19), LTE1500 (B21), TD-LTE2500 (B41), TD-LTE2600 (B38), TD-LTE2300 (B40), TD-LTE1900 (B39), LTE700 (B28), LTE700 (B29), TD-LTE3500 (B42), LTE1500 (B32), LTE1700/2100 (B66), TD-LTE5900  (B46), TD-LTE3600  (B48), TD-LTE2000 (B34)","GPRS, EDGE, UMTS, HSDPA, HSDPA 14.4, HSPA+ 21.1, DC-HSDPA 42.2, HSUPA, HSUPA 5.8, LTE, LTE 100/50, LTE 150/50, LTE 300/75, LTE 300/50, LTE 300/100, LTE 450/50, LTE 450/100, LTE 600/50, LTE 600/100, LTE 400/150, LTE 1000/100, LTE 1600, LTE 1200/200","Nano-SIM (4FF)","Internal antenna","Qualcomm SM8250","Capacitive multi-touch","10-point","","No","No","No","No","","No","No","","No","No","microSD, microSDHC, TransFlash, microSDXC","USB 3.1","USB HS (480 Mbps)","USB Host, USB OTG 1.3, USB OTG 2.0, USB PD, USB charging, USB PD 2.0, USB PD 3.0, USB fast charging","USB C reversible","21","No","No","No","No","No","No","No","No","Bluetooth 5.1","A2DP, AVRCP, DIP, GAVDP, GAP, HFP, HID, HSP, OPP, PAN, PBA, SPP, A2DP aptX, MAP, A2DP aptX HD","","802.11a, 802.11b, 802.11g, 802.11n, 802.11ac, 802.11ax","Wi-Fi Direct, Miracast, Wi-Fi Calling","","No","NFC A, NFC B","No","No","No","No","No","No","No","No","GPS","","Internal antenna","A-GPS, QuickGPS, Geotagging, Simultaneous GPS","Any","No","No","Qualcomm SM8250","Rear","Sony IMX557","BSI CMOS","1/1.70","0","4032x3024","12.2","f/1.70","","3","3","MF, PD AF","24","","JPG, RAW","3840x2160","60","MPEG4","dual LED","Macro mode, EIS (video), Face detection, Smile detection, Touch focus, OIS, Panorama Photo, HDR photo, HDR video, Red-eye reduction, Slow motion video, Face tagging, Face retouch, OIS (video), Face retouch (video), Burst mode, Intelligent scene detection","Samsung S5K3TS","BSI CMOS","1/2.55","0","12.2","f/2.20","16","PD AF","Panorama Photo, HDR photo, HDR video, OIS (video), Burst mode, Intelligent scene detection","BSI CMOS","0","1/3.40","12.2","f/2.40","70","PD AF","Macro mode, Face detection, Smile detection, Touch focus, OIS, Panorama Photo, HDR photo, Face tagging, Burst mode, Intelligent scene detection","Mono CMOS","0","0.3","","","No","No","No","0.0","0","","No","No","Front","Samsung ISOCELL S5K4H7","BSI CMOS","1/4.00","1.12","3264x2448","8.0","f/2.00","No","24","JPG, RAW","1920x1080","30","MPEG4","No","EIS, EIS (video), Face detection, Smile detection, Touch focus, Panorama Photo, HDR photo, Face tagging, Face retouch, Burst mode","No","0","0.0","","No","0.0","","Any","3D","Any","L sensor, P sensor, Barometer, FP sensor, Step counter","No","6 Totally protected from dust ","8 Protected against immersion beyond 1m of depth","","","","No","Li-ion","built-in","","1","3.87","4000","0","","3.87","4000","15.48","0","","","","0","","","No","0","Japan","Asia","","259000","JPY","sony_xperia_pro_2021_2.jpg","Final","2021-04-18 16:59","18257"
