"Xiaomi","Redmi 9C NFC Global Dual SIM TD-LTE 32GB","M2006C3MNG","Xiaomi Angelica","","Low-end Android 10 smartphone with MediaTek Helio G35 processor, 2 GiB of LP-DDR4x SD-RAM, 32 GB eMMC 5.1 ROM, NFC and triple lens rear camera system","2020 Aug","2020 Jun","Xiaomi","","","Haptic touch feedback","Smartphone","","77.07","3.03","164.9","6.49","9","0.35","","114.4","194","6.84","Android","Google Android 10 (Q)","MIUI 12","","Voice Command, Navigation software, Augmented Reality (AR), Intelligent personal assistant, Face Recognition","2300","MediaTek Helio G35 MT6765V/CB","LPDDR4x SDRAM","1600","2048","","","Flash EEPROM","eMMC 5.1","","30518","","","No","","","","1","","165.9","6.5","720x1600","1152000","68.08","2.68","151.29","5.96","8.99","10299.6","81","0.09455","269","Color IPS TFT LCD","No","24","16.8M","8","LED","transflective","Any","","Gorilla Glass 3","","","","","","","","","","","","","No","No","","","","No","No","No","No","IMG PowerVR GE8320","","680","","No","No","No","No","No","stereo","","","","stereo","No","","","mono","","3.5mm","GSM850, GSM900, GSM1800, GSM1900, UMTS850 (B5), UMTS900 (B8), UMTS1700/2100 (B4), UMTS1900 (B2), UMTS2100 (B1), LTE2100 (B1), LTE1700/2100 (B4), LTE850 (B5), LTE1800 (B3), LTE2600 (B7), LTE1900 (B2), LTE900 (B8), LTE800 (B20), TD-LTE2600 (B38), TD-LTE2300 (B40)","GPRS, EDGE, UMTS, HSDPA, HSPA+ 21.1, HSPA+ 42.2, DC-HSDPA 42.2, HSUPA, HSUPA 5.8, LTE, LTE 100/50, LTE 150/50, LTE 300/50, LTE 600/50","Nano-SIM (4FF)","Internal antenna","64","No","Voice transmission, Voice speaker, Vibrate, Speakerphone, ANC, HD Voice, VoLTE","MediaTek MT6765","0.57","US","No","0.9","US","No","0.9","EU","No","0.37","EU","No","0.114","EU","No","Dual standby","GSM850, GSM900, GSM1800, GSM1900, UMTS850 (B5), UMTS900 (B8), UMTS1700/2100 (B4), UMTS1900 (B2), UMTS2100 (B1), LTE2100 (B1), LTE1700/2100 (B4), LTE850 (B5), LTE1800 (B3), LTE2600 (B7), LTE1900 (B2), LTE900 (B8), LTE800 (B20), TD-LTE2600 (B38), TD-LTE2300 (B40)","GPRS, EDGE, UMTS, HSDPA, HSPA+ 42.2, DC-HSDPA 42.2, HSUPA, HSUPA 5.8, LTE, LTE 100/50, LTE 150/50, LTE 300/50, LTE 600/50","Nano-SIM (4FF)","Internal antenna","MediaTek MT6765","Capacitive multi-touch","10-point","","No","No","No","No","","No","No","","No","No","microSD, microSDHC, TransFlash, microSDXC","USB 2.0","USB HS (480 Mbps)","USB Host, USB OTG 1.3, USB charging","USB Micro-AB","10","No","No","No","No","No","No","No","No","Bluetooth 5.0","A2DP, AVRCP, GAVDP, HID, HSP, OPP, PAN, PBA, A2DP aptX, MAP, A2DP aptX HD","","802.11b, 802.11g, 802.11n","Wi-Fi Direct, Wi-Fi Tethering, Wi-Fi Calling","","No","No","No","No","No","FM radio (76-108 MHz) with RDS","Internal antenna","No","No","No","GPS","","Internal antenna","A-GPS, QuickGPS, Dual-frequency GPS, Geotagging, Simultaneous GPS, QZSS","Any","No","BeiDou-2","MediaTek MT6765","Rear","","BSI CMOS","","0","4160x3120","13.0","f/2.20","","1","0","PD AF","","","JPG","1920x1080","30","MPEG4","single LED","Face detection, Smile detection, Touch focus, Panorama Photo, HDR photo, Face tagging, Burst mode","","CMOS","","1.75","1.9","f/2.40","","No","Macro mode, HDR photo, Burst mode","Mono CMOS","1.75","","1.9","f/2.40","","No","No","No","0","0.0","","","No","No","No","0.0","0","","No","No","Front","","CMOS","","1.12","2560x1920","4.9","f/2.00","No","","JPG","1280x720","30","MPEG4","No","Face detection, Smile detection, Panorama Photo, HDR photo, HDR video, Face tagging, Face retouch, Burst mode","No","0","0.0","","No","0.0","","No","3D","No","L sensor, P sensor, FP sensor","No","Any","Any","","","","No","Li-ion polymer (LiPo)","built-in","","1","3.87","5000","0","","3.87","5000","19.35","0","","","","0","","","No","0","Hungary, Italy, Germany, Spain, France, UK, Poland, Russia, Turkey, Taiwan, Indonesia, Mexico, Malaysia, Singapore, HK, Thailand, Vietnam, Ukraine","Europe, Eastern Europe, Western Europe, Asia, Middle East , Southeast Asia, North America","","","No","xiaomi_redmi_9c.jpg","Final","2020-10-20 11:39","17580"
"Xiaomi","Redmi Note 9 Pro Global Dual SIM TD-LTE 64GB","M2003J6B2G","Xiaomi Joyeuse","","Redmi Note 9 Pro Max modified subversion for the global market with 6 GiB of RAM, 64 GB flash memory and 16 MP selfie camera","2020 May","2020 Apr 29","Xiaomi","","","Haptic touch feedback","Smartphone","720p 120 fps slow-motion video recording, HDR10","76.68","3.02","165.5","6.52","8.8","0.35","","111.7","209","7.37","Android","Google Android 10 (Q)","MIUI 11","","Voice Command, Navigation software, Intelligent personal assistant, Face Recognition","2300","Qualcomm Snapdragon 720G SM7125 (Atoll)","LPDDR4x SDRAM","1866","6144","","","Flash EEPROM","UFS 2.1","","61035","","","No","","","","","1","169.4","6.7","1080x2400","2592000","69.52","2.74","154.48","6.08","7.16","10738.8","84.6","0.06437","395","Color IPS TFT LCD","No","24","16.8M","10","LED","Any","Any","60","Gorilla Glass 5","","","","","","","","","","","","","No","No","","","","No","No","No","No","Qualcomm Adreno 618","0.5","750","","No","No","No","No","No","stereo","","","","stereo","No","","","mono","","3.5mm","GSM850, GSM900, GSM1800, GSM1900, UMTS850 (B5), UMTS900 (B8), UMTS1700/2100 (B4), UMTS1900 (B2), UMTS2100 (B1), LTE2100 (B1), LTE1700/2100 (B4), LTE850 (B5), LTE1800 (B3), LTE2600 (B7), LTE1900 (B2), LTE900 (B8), LTE800 (B20), TD-LTE2500 (B41), TD-LTE2600 (B38), TD-LTE2300 (B40), LTE700 (B28)","GPRS, EDGE, UMTS, HSDPA, HSPA+ 21.1, DC-HSDPA 42.2, HSUPA, HSUPA 5.8, HSUPA 11.5, LTE, LTE 100/50, LTE 150/50, LTE 300/50","Nano-SIM (4FF)","Internal antenna","64","No","Voice transmission, Voice speaker, Vibrate, Speakerphone, ANC, HD Voice, VoLTE","Qualcomm SM7125","0.87","US","No","0.71","US","No","1.04","US","No","0","No","No","0","No","No","Dual standby","GSM850, GSM900, GSM1800, GSM1900, UMTS850 (B5), UMTS900 (B8), UMTS1700/2100 (B4), UMTS1900 (B2), UMTS2100 (B1), LTE2100 (B1), LTE1700/2100 (B4), LTE850 (B5), LTE1800 (B3), LTE2600 (B7), LTE1900 (B2), LTE900 (B8), LTE800 (B20), TD-LTE2500 (B41), TD-LTE2600 (B38), TD-LTE2300 (B40), LTE700 (B28)","GPRS, EDGE, UMTS, HSDPA, HSPA+ 21.1, DC-HSDPA 42.2, HSUPA, HSUPA 5.8, HSUPA 11.5, LTE, LTE 100/50, LTE 150/50, LTE 300/50","Nano-SIM (4FF)","Internal antenna","Qualcomm SM7125","Capacitive multi-touch","Any","","No","No","No","No","","No","No","","No","No","microSD, microSDHC, TransFlash, microSDXC","USB 2.0","USB HS (480 Mbps)","USB Host, USB OTG 1.3, USB PD, USB charging, USB fast charging","USB C reversible","30","No","No","No","No","No","No","No","No","Bluetooth 5.0","A2DP, AVRCP, GAVDP, HFP, HID, HSP, PAN, PBA, A2DP aptX, MAP, A2DP aptX HD","","802.11a, 802.11b, 802.11g, 802.11n, 802.11ac","Wi-Fi Tethering, WiDi, Wi-Fi Calling","","No","No","Any","No","No","No","No","No","No","No","GPS","","Internal antenna","A-GPS, QuickGPS, Geotagging, Simultaneous GPS, NavIC","Any","Any","BeiDou-2","Qualcomm SM7125","Rear","","BSI CMOS","1/1.72","0.8","9216x6912","63.7","f/1.89","","1","10","PD AF","","","JPG","3840x2160","30","MPEG4","single LED","Face detection, Smile detection, Touch focus, Panorama Photo, HDR photo, HDR video, Red-eye reduction, Slow motion video, Face tagging, Face retouch, Face retouch (video), Burst mode, Intelligent scene detection, Pixel unification","","BSI CMOS","1/4.00","1.12","8.0","f/2.20","","No","Face detection, Panorama Photo, HDR photo, Burst mode, Intelligent scene detection","BSI CMOS","1.12","1/5.00","4.9","f/2.20","","CD AF","Macro mode, Touch focus, Panorama Photo, HDR photo, Burst mode, Intelligent scene detection","CMOS","1.75","1.9","f/2.40","","No","Macro mode, Burst mode","No","0.0","0","","No","No","Front","","BSI CMOS","","1","4608x3456","15.9","f/2.48","No","","JPG","1920x1080","30","MPEG4","No","Face detection, Smile detection, Panorama Photo, HDR photo, Slow motion video, Face retouch, Face retouch (video), Intelligent scene detection","No","0","0.0","","No","0.0","","Any","Any","Any","L sensor, P sensor, FP sensor","No","Non-standard protection","Any","","","","No","Li-ion polymer (LiPo)","built-in","","1","0","5020","0","","0","5020","0","0","","490","10","29","173","","No","0","Italy, Germany, Spain, UK, Poland, Russia, Turkey, Mexico, Brazil, Chile, Saudi Arabia, Malaysia, Singapore, UAE, HK, Thailand, Vietnam, Philippines, Ukraine","Europe, Eastern Europe, Western Europe, Asia, Middle East , North America, South America, Oceania","","","No","xiaomi_redmi_note_9_pro_max_2.jpg","Final","2020-06-08 13:11","17081"
"Samsung","Galaxy M01 2020 Dual SIM TD-LTE APAC 32GB","SM-M015G/DS","Samsung M015","M015GZKDINS","Samsung M01 budget smartphone has 5.7-inch PLS TFT display, 32 GB eMMC 5.1 flash memory, dual lens rear camera system and 5 MP selfie camera. It is the 3 / 32 GB Asian variant.","2020 Jun","2020 Jun 2","Samsung Electronics","Samsung Electronics","","Haptic touch feedback","Smartphone","","70.9","2.79","147.5","5.81","9.8","0.39","","102.5","168","5.93","Android","Google Android 10 (Q)","One UI 2.0","","Navigation software, Intelligent personal assistant, Face Recognition","2020","Qualcomm Snapdragon 439 SDM439","LPDDR3 SDRAM","933","3072","2849","","Flash EEPROM","eMMC 5.1","","30518","","22600","No","","","","1","","144.8","5.7","720x1520","1094400","61.99","2.44","130.86","5.15","8.91","8111.7","77.6","0.08609","295","Color PLS TFT LCD","No","24","16.8M","8","LED","Any","Any","","Any","","","","","","","","","","","","","No","No","","","","No","No","No","No","Qualcomm Adreno 505","0.125","","8","No","No","No","No","No","stereo","","","","stereo","No","","","mono","","3.5mm","GSM900, GSM1800, UMTS850 (B5), UMTS900 (B8), UMTS2100 (B1), LTE2100 (B1), LTE850 (B5), LTE1800 (B3), LTE900 (B8), TD-LTE2500 (B41), TD-LTE2300 (B40)","GPRS, GPRS MSC33, EDGE, UMTS, HSDPA, HSPA+ 21.1, DC-HSDPA 42.2, HSUPA, HSUPA 5.8, LTE, LTE 100/50, LTE 150/50","Nano-SIM (4FF)","Internal antenna","64","No","Voice transmission, Voice speaker, Vibrate, Speakerphone, ANC, HD Voice, VoLTE","Qualcomm SDM439","0.61","EU","No","0","No","No","0","No","No","0","No","No","0","No","No","Dual standby","GSM900, GSM1800, UMTS850 (B5), UMTS900 (B8), UMTS2100 (B1), LTE2100 (B1), LTE850 (B5), LTE1800 (B3), LTE900 (B8), TD-LTE2500 (B41), TD-LTE2300 (B40)","GPRS, EDGE, UMTS, HSDPA, HSPA+ 21.1, DC-HSDPA 42.2, HSUPA, HSUPA 5.8, LTE, LTE 100/50, LTE 150/50","Nano-SIM (4FF)","Internal antenna","Qualcomm SDM439","Capacitive multi-touch","Any","","No","No","No","No","","No","No","","No","No","microSD, microSDHC, TransFlash, microSDXC","USB 2.0","USB HS (480 Mbps)","USB Host, USB OTG 1.3, USB charging","USB Micro-AB","0","No","No","No","No","No","No","No","No","Bluetooth 4.2","A2DP, AVRCP, DIP, HCRP, HFP, HID, HSP, OPP, PAN, PBA, A2DP aptX, MAP","","802.11b, 802.11g, 802.11n","Wi-Fi Direct, Wi-Fi Tethering","","No","No","No","No","No","Unknown","Unknown","No","No","No","GPS","","Internal antenna","A-GPS, QuickGPS, Geotagging, Simultaneous GPS","Any","Any","BeiDou-2","Qualcomm SDM439 iZat","Rear","","BSI CMOS","","1.12","4160x3120","13.0","f/2.20","","1","8","PD AF","","","JPG","1920x1080","30","MPEG4","single LED","Macro mode, Face detection, Smile detection, Touch focus, Panorama Photo, HDR photo, Red-eye reduction, Face tagging, Face retouch, Burst mode","","CMOS","","0","1.9","f/2.40","","No","No","No","0","","0.0","","","No","No","No","0","0.0","","","No","No","No","0.0","0","","No","No","Front","","BSI CMOS","","0","2560x1920","4.9","f/2.20","No","","JPG","1920x1080","30","3GP","No","Face detection, Smile detection, Panorama Photo, HDR photo, Face tagging, Face retouch, Burst mode","No","0","0.0","","No","0.0","","No","Any","No","L sensor, P sensor","No","Any","Any","","","","No","Li-ion","built-in","","1","0","4000","0","","0","4000","0","0","","","","0","","","No","0","India, Vietnam, Sri Lanka, Nepal","Asia, Southeast Asia","","","No","samsung_galaxy_m01.jpg","Final","2020-06-09 22:39","17089"
"Samsung","Galaxy A50s 2019 Dual SIM TD-LTE CN 128GB","SM-A5070","Samsung A507","A5070ZKGCHC","Chinese dual SIM variant of Galaxy A50s with NFC support and 6 / 128 GB memory","2019 Oct","2019 Aug 22","Samsung Electronics","Samsung Electronics","","Haptic touch feedback","Smartphone","Bixby Assistant, Infinity-V Display, Live Focus, 720p 240 fps video recording","74.5","2.93","158.5","6.24","7.7","0.3","","90.9","166","5.86","Android","Google Android 9.0 (Pie)","One UI 1.0","","Voice Command, Navigation software, Intelligent personal assistant, Face Recognition","2290","Samsung Exynos 9 Octa 9610","LPDDR4x SDRAM","","6144","","","Flash EEPROM","Any","","122070","","108650","No","","","","1","","162.1","6.4","1080x2340","2527200","67.93","2.67","147.18","5.79","6.57","9997.9","84.7","0.0629","404","AM-OLED","Super AM-OLED","24","16.8M","8","Self-illuminating","Any","RGBG PenTile Matrix","","Any","Samsung","","","","","","","","","","","","No","No","","","","No","No","No","No","ARM Mali-G72MP3","","","","No","No","No","No","No","stereo","","","","stereo","No","","","mono","","3.5mm","GSM850, GSM900, GSM1800, GSM1900, CDMA800 (BC0), UMTS850 (B5), UMTS900 (B8), UMTS1900 (B2), UMTS2100 (B1), LTE2100 (B1), TD-SCDMA2000, TD-SCDMA1900, LTE850 (B5), LTE1800 (B3), LTE2600 (B7), LTE900 (B8), TD-LTE2500 (B41), TD-LTE2600 (B38), TD-LTE2300 (B40), TD-LTE1900 (B39), TD-LTE2000 (B34)","GPRS, GPRS MSC33, EDGE, UMTS, TD-SCDMA, TD-HSDPA, HSDPA, HSPA+ 21.1, DC-HSDPA 42.2, HSUPA, HSUPA 5.8, cdmaOne, CDMA2000 1x, CDMA2000 1xEV-DO, CDMA2000 1xEV-DO Rev A, LTE, LTE 100/50, LTE 150/50, LTE 300/50","Nano-SIM (4FF)","Internal antenna","64","No","Voice transmission, Voice speaker, Vibrate, Speakerphone, ANC, HD Voice, VoLTE","Samsung Exynos 9610 ModAP","0.769","US","No","0","No","No","0","No","No","0","No","No","0","No","No","Dual standby","GSM850, GSM900, GSM1800, GSM1900, CDMA800 (BC0), UMTS850 (B5), UMTS900 (B8), UMTS1900 (B2), UMTS2100 (B1), LTE2100 (B1), LTE850 (B5), LTE1800 (B3), LTE2600 (B7), LTE900 (B8), TD-LTE2500 (B41), TD-LTE2600 (B38), TD-LTE2300 (B40), TD-LTE1900 (B39), TD-LTE2000 (B34)","GPRS, GPRS MSC33, EDGE, EDGE MSC33, UMTS, HSDPA, HSPA+ 21.1, DC-HSDPA 42.2, HSUPA, HSUPA 5.8, cdmaOne, CDMA2000 1x, CDMA2000 1xEV-DO, CDMA2000 1xEV-DO Rev A, LTE, LTE 100/50, LTE 150/50, LTE 300/50","Nano-SIM (4FF)","Internal antenna","Samsung Exynos 9610 ModAP","Capacitive multi-touch","10-point","","No","No","No","No","","No","No","","No","No","microSD, microSDHC, TransFlash, microSDXC","USB 2.0","USB HS (480 Mbps)","USB Host, USB OTG 1.3, USB PD, USB charging, USB fast charging","USB C reversible","15","No","No","No","No","No","No","No","No","Bluetooth 5.0","A2DP, AVRCP, DIP, HCRP, HFP, HID, HSP, OPP, PAN, PBA, A2DP aptX, MAP","","802.11a, 802.11b, 802.11g, 802.11n, 802.11ac","Wi-Fi Direct, Wi-Fi Tethering","","No","NFC A, NFC B","No","No","No","FM radio (88-108 MHz) with RDS","Proprietary headset","No","No","No","GPS","","Internal antenna","A-GPS, QuickGPS, Geotagging, Simultaneous GPS","Any","Any","BeiDou-2","Samsung Exynos 9610 ModAP","Rear","","BSI CMOS","1/2.00","0.8","8000x6000","48.0","f/2.00","","1","4","PD AF","26","","JPG","3840x2160","30","MPEG4","single LED","Macro mode, Face detection, Smile detection, Touch focus, Panorama Photo, HDR photo, Red-eye reduction, Slow motion video, Face tagging, Face retouch, Burst mode","","CMOS","","0","4.9","f/2.20","","No","No","CMOS","0","","8.0","f/2.20","13","No","No","No","0","0.0","","","No","No","No","0.0","0","","No","No","Front","","BSI CMOS","","0","6528x4896","32.0","f/2.00","No","","JPG","","","3GP","No","Face detection, Smile detection, Panorama Photo, HDR photo, HDR video, Face tagging, Face retouch, Face retouch (video), Burst mode","No","0","0.0","","No","0.0","","Any","Any","Any","L sensor, P sensor, Hall, In-screen FP sensor","No","Any","Any","","","","No","Li-ion polymer (LiPo)","built-in","","1","0","4000","0","","0","4000","0","15","267","375","11","32","125","","No","0","China","Asia","China Telecom Corporation Limited","","No","samsung_galaxy_a50s_2019.jpg","Final","2020-08-11 11:12","17325"
"Xiaomi","Redmi 9T Standard Edition Global Dual SIM TD-LTE 128GB","M2010J19SG","Xiaomi Lime","","Lower mid-range smartphone with 400 nit IPS screen, IR port, 3 card slots (2x nano-SIM + microSD), side fingerprint sensor, NFC, 4 GiB of RAM, 128 GB UFS 2.2 ROM, auto-cleaning stereo speakers and 6 Ah battery","2021 Jan","2021 Jan 8","Xiaomi","","","Haptic touch feedback","Smartphone","720p 120 fps slow-motion video recording","77.3","3.04","162.3","6.39","9.6","0.38","","120.4","198","6.98","Android","Google Android 10 (Q)","MIUI 12","","Voice Command, Navigation software, Intelligent personal assistant, Face Recognition","2000","Qualcomm Snapdragon 662 SM6115","LPDDR4x SDRAM","1866","4096","","","Flash EEPROM","UFS 2.2","","122070","","","No","","","","1","","165.8","6.5","1080x2340","2527200","69.48","2.74","150.54","5.93","7.82","10459.5","83.4","0.06433","395","Color IPS TFT LCD","No","24","16.8M","8","LED","Any","Any","","Gorilla Glass 3","","","","","","","","","","","","","No","No","","","","No","No","No","No","Qualcomm Adreno 610","0.5","950","","No","No","No","No","No","stereo","","","","stereo","No","","","stereo","","3.5mm","GSM850, GSM900, GSM1800, GSM1900, UMTS850 (B5), UMTS900 (B8), UMTS1700/2100 (B4), UMTS1900 (B2), UMTS2100 (B1), LTE2100 (B1), LTE1700/2100 (B4), LTE850 (B5), LTE1800 (B3), LTE2600 (B7), LTE1900 (B2), LTE900 (B8), LTE800 (B20), TD-LTE2500 (B41), TD-LTE2600 (B38), TD-LTE2300 (B40), LTE700 (B28)","GPRS, EDGE, UMTS, HSDPA, HSPA+ 21.1, DC-HSDPA 42.2, HSUPA, HSUPA 5.8, HSUPA 11.5, LTE, LTE 100/50, LTE 150/50, LTE 300/50, LTE 600/50","Nano-SIM (4FF)","Internal antenna","64","No","Voice transmission, Voice speaker, Vibrate, Speakerphone, ANC, HD Voice, VoLTE","Qualcomm SM6115","1.09","US","No","1","US","No","1.1","US","No","0.597","EU","No","0.807","EU","No","Dual standby","GSM850, GSM900, GSM1800, GSM1900, UMTS850 (B5), UMTS900 (B8), UMTS1700/2100 (B4), UMTS1900 (B2), UMTS2100 (B1), LTE2100 (B1), LTE1700/2100 (B4), LTE850 (B5), LTE1800 (B3), LTE2600 (B7), LTE1900 (B2), LTE900 (B8), LTE800 (B20), TD-LTE2500 (B41), TD-LTE2600 (B38), TD-LTE2300 (B40), LTE700 (B28)","GPRS, EDGE, UMTS, HSDPA, HSPA+ 21.1, DC-HSDPA 42.2, HSUPA, HSUPA 5.8, HSUPA 11.5, LTE, LTE 100/50, LTE 150/50, LTE 300/50, LTE 600/50","Nano-SIM (4FF)","Internal antenna","Qualcomm SM6115","Capacitive multi-touch","10-point","","No","No","No","No","","No","No","","No","No","microSD, microSDHC, TransFlash, microSDXC","USB 2.0","USB HS (480 Mbps)","USB Host, USB OTG 1.3, USB PD, USB charging, USB fast charging","USB C reversible","18","No","No","No","No","No","No","No","No","Bluetooth 5.0","A2DP, AVRCP, GAVDP, HFP, HID, HSP, PAN, PBA, A2DP aptX, MAP, A2DP aptX HD","","802.11a, 802.11b, 802.11g, 802.11n, 802.11ac","Wi-Fi Tethering, WiDi, Wi-Fi Calling","","No","NFC A, NFC B","Any","No","No","FM radio (76-108 MHz)","Proprietary headset","No","No","No","GPS","","Internal antenna","A-GPS, QuickGPS, Geotagging, Simultaneous GPS, NavIC","Any","Any","BeiDou-2","Qualcomm SM6115","Rear","","BSI CMOS","1/2.00","0.8","8000x6000","48.0","f/1.79","","1","10","PD AF","","","JPG","1920x1080","30","MPEG4","single LED","Face detection, Smile detection, Touch focus, Panorama Photo, HDR photo, HDR video, Red-eye reduction, Slow motion video, Face tagging, Face retouch, Face retouch (video), Burst mode, Intelligent scene detection, Pixel unification","","BSI CMOS","","1.12","8.0","f/2.20","","No","Face detection, Smile detection, Panorama Photo, Face tagging, Burst mode","CMOS","1.75","","1.9","f/2.40","","No","Macro mode, Burst mode","Mono CMOS","1.75","1.9","f/2.40","","No","No","No","0.0","0","","No","No","Front","","BSI CMOS","1/4.00","1.12","3264x2448","8.0","f/2.05","No","","JPG","1920x1080","30","MPEG4","No","Face detection, Smile detection, Panorama Photo, HDR photo, Face tagging, Face retouch, Intelligent scene detection","No","0","0.0","","No","0.0","","Any","Any","No","L sensor, P sensor, FP sensor","No","Any","Any","","","","No","Li-ion","built-in","","1","0","6000","0","","0","6000","0","14","359","695","9","45","133","","No","0","Hungary, Italy, Germany, Spain, France, UK, Turkey, Taiwan, UAE, Thailand, Vietnam, Czech, Ukraine","Europe, Eastern Europe, Western Europe, Asia, Middle East ","","189","EUR","xiaomi_redmi_9_power.jpg","Final","2021-02-06 17:01","18069"
"LG","K Series K51 2020 TD-LTE LMK500UM3","LMK500UM3","LG X540","LMK500UM3.ABMUTN","Affordable 6.5-inch single SIM smartphone for Boost Mobile (USA) with Helio P22 CPU, triple lens rear camera","2020 May","2020 May 4","LG Electronics","LG Electronics","","Haptic touch feedback","Smartphone","DTS:X 3D Surround Sound","77.92","3.07","166.96","6.57","8.47","0.33","","110.2","204.3","7.21","Android","Google Android 9.0 (Pie)","","","Voice Command, Navigation software, Intelligent personal assistant, Face Recognition","2000","MediaTek Helio P22 MT6762","LPDDR3 SDRAM","933","3072","","","Flash EEPROM","eMMC 5.1","","30518","","16500","No","","","","1","","165","6.5","720x1560","1123200","69.14","2.72","149.81","5.9","8.78","10358.8","79.6","0.09603","264","Color IPS TFT LCD","No","24","16.8M","8","LED","Any","RGB Matrix","60","Any","","","","","","","","","","","","","No","No","","","","No","No","No","No","PowerVR GE8320","","650","","No","No","No","No","No","8","","","","stereo","No","","","mono","1","3.5mm","GSM850, GSM900, GSM1800, GSM1900, CDMA800 (BC0), CDMA1900 (BC1/BC14), UMTS850 (B5), UMTS900 (B8), UMTS1900 (B2), UMTS2100 (B1), LTE700 (B13), LTE1700/2100 (B4), LTE850 (B5), LTE1900 (B2), LTE1900 (B25), LTE700 (B12), CDMA800 (BC10), LTE850 (B26), TD-LTE2500 (B41), LTE1700/2100 (B66), LTE600 (B71)","GPRS, GPRS C12, GPRS MSC12, GPRS MSC33, EDGE, EDGE MSC12, UMTS, HSDPA, HSPA+ 21.1, DC-HSDPA 42.2, HSUPA, HSUPA 5.8, cdmaOne, CDMA2000 1x, CDMA2000 1xEV-DO, CDMA2000 1xEV-DO Rev A, LTE, LTE 100/50, LTE 150/50","Nano-SIM (4FF)","Internal antenna","128","M3, T3","Voice transmission, Voice speaker, Vibrate, Speakerphone, ANC, HD Voice, VoLTE, ViLTE","MediaTek MT6762","0","No","No","0","No","No","0","No","No","0","No","No","0","No","No","No","No","No","No","No","","Capacitive multi-touch","Any","","No","No","No","No","","No","No","","No","No","microSD, microSDHC, TransFlash, microSDXC","USB 2.0","USB HS (480 Mbps)","USB Host, USB OTG 1.3, USB PD, USB charging","USB C reversible","0","No","No","No","No","No","No","No","No","Bluetooth 5.0","A2DP, AVRCP, DIP, GAVDP, GOEP, HFP, HID, HSP, OPP, PAN, PBA, SPP, A2DP aptX, MAP","","802.11a, 802.11b, 802.11g, 802.11n, 802.11ac","Wi-Fi Direct, Wi-Fi Tethering, DLNA, Miracast, Wi-Fi Calling","","No","No","No","No","No","No","No","No","No","No","GPS","","Internal antenna","A-GPS, QuickGPS, Geotagging, Simultaneous GPS","Any","No","No","MediaTek MT6762","Rear","","BSI CMOS","1/3.09","1.12","4160x3120","13.0","f/1.80","","1","4","PD AF","","","JPG, RAW","1920x1080","30","MPEG4","single LED","Macro mode, Face detection, Smile detection, Touch focus, Panorama Photo, HDR photo, HDR video, Red-eye reduction, Slow motion video, Face tagging, Face retouch, Burst mode","","CMOS","1/5.00","1.12","4.9","f/2.20","","No","No","CMOS","1.75","1/5.00","1.9","f/2.40","","No","No","No","0","0.0","","","No","No","No","0.0","0","","No","No","Front","","CMOS","1/3.09","1.12","4160x3120","13.0","f/2.00","No","","JPG","1920x1080","30","MPEG4","No","Face detection, Smile detection, HDR photo, Face tagging, Face retouch","No","0","0.0","","No","0.0","","Any","3D","No","L sensor, P sensor, FP sensor","No","Any","Any","","","","MIL-STD-810G","Li-ion","built-in","","1","3.85","4000","0","","3.85","4000","15.4","0","","520","8","17","235","","No","0","USA","North America","Boost Mobile US","","No","lg_k51_2020.jpg","Final","2020-09-13 13:28","17429"
