"Samsung","Galaxy S21 5G Global Dual SIM TD-LTE 256GB","SM-G991B/DS","Samsung Unbound M1","G991BZAGEUB","Galaxy S21 deploys adaptive refresh rate 6.2-inch Flat FHD+ AMOLED display, 8 GiB of RAM, 256 GB flash memory and triple lens AI rear camera setup (large pixel 12 MP main wide-angle, 12 MP ultra wide-angle, 64 MP telephoto)","2021 Jan 29","2021 Jan 14","Samsung Electronics","Samsung Electronics","Samsung SM-G981B/DS Galaxy S20 5G Global Dual SIM TD-LTE 128GB (Samsung Hubble 0 5G)","Haptic touch feedback","Smartphone","vapor chamber liquid cooling system, Samsung Infinity-O Display, Samsung Bixby AI assistant, Samsung Pay, Samsung DeX, HDR10+ support, Dolby Atmos sound, 720p 960 fps slow-motion video capture, dual-pixel PDAF, in-display ultrasonic fingerprint scanner","71.2","2.8","151.7","5.97","7.9","0.31","","85.3","170","6","Android","Google Android 11 (R)","One UI 3.1","","Voice Command, Business card recognition, Navigation software, Augmented Reality (AR), Virtual Reality (VR) support, Intelligent personal assistant, Voice Recognition, Face Recognition","2900","Samsung Exynos 2100 5G","LPDDR5 SDRAM","","8192","","","Flash EEPROM","UFS 3.1","","244140","","225700","No","","","","","1","158.4","6.2","1080x2400","2592000","65","2.56","144.45","5.69","6.2","9389.4","86.9","0.06019","422","AM-OLED","Dynamic AM-OLED","24","16.8M","10","Self-illuminating","Any","Any","120","Gorilla Glass Victus","Samsung","","","","","","","","","","","","No","No","","","","No","No","No","No","ARM Mali-G78 MP14","","","","DisplayPort","USB Type-C reversible","No","3840x2160 (2160p)","No","stereo","","32","384000","stereo","No","32","384000","stereo","","USB Type-C","GSM850, GSM900, GSM1800, GSM1900, UMTS850 (B5), UMTS900 (B8), UMTS1700/2100 (B4), UMTS1900 (B2), UMTS2100 (B1), LTE2100 (B1), LTE700 (B17), LTE700 (B13), LTE1700/2100 (B4), LTE850 (B5), LTE1800 (B3), LTE2600 (B7), LTE1900 (B2), LTE800 (B18), LTE900 (B8), LTE800 (B20), LTE1900 (B25), LTE700 (B12), LTE850 (B26), LTE800 (B19), TD-LTE2500 (B41), TD-LTE2600 (B38), TD-LTE2300 (B40), TD-LTE1900 (B39), LTE700 (B28), LTE1500 (B32), LTE1700/2100 (B66), NR800 (N20), TD-NR2500 (N41), TD-NR3700 (N77), TD-NR3500 (N78), NR2100 (N1), NR1800 (N3), NR700 (N28), TD-NR2600 (N38), NR850 (N5), NR2600 (N7), NR900 (N8), TD-NR2300 (N40), NR1700/2100 (N66)","GPRS, GPRS C12, EDGE, EDGE MSC12, UMTS, HSDPA, HSPA+ 21.1, DC-HSDPA 42.2, HSUPA, HSUPA 5.8, LTE, LTE 100/50, LTE 150/50, LTE 300/75, LTE 300/50, LTE 300/100, LTE 450/50, LTE 450/100, LTE 600/50, LTE 600/100, LTE 400/150, LTE 1000/100, LTE 1600, LTE 1200/200, LTE 2000/300, NR 2600, NR 4600, NR 3700","e-SIM","Internal antenna","128","M3, T3","Voice transmission, Voice speaker, Vibrate, Speakerphone, ANC, HD Voice, VoLTE, ViLTE","Samsung Exynos 2100 ModAP","0","No","No","0","No","No","0","No","No","0","No","No","0","No","No","Dual standby","GSM850, GSM900, GSM1800, GSM1900, UMTS850 (B5), UMTS900 (B8), UMTS1700/2100 (B4), UMTS1900 (B2), UMTS2100 (B1), LTE2100 (B1), LTE700 (B17), LTE700 (B13), LTE1700/2100 (B4), LTE850 (B5), LTE1800 (B3), LTE2600 (B7), LTE1900 (B2), LTE800 (B18), LTE900 (B8), LTE800 (B20), LTE1900 (B25), LTE700 (B12), LTE850 (B26), LTE800 (B19), TD-LTE2500 (B41), TD-LTE2600 (B38), TD-LTE2300 (B40), TD-LTE1900 (B39), LTE700 (B28), LTE1500 (B32), LTE1700/2100 (B66)","GPRS, GPRS C12, EDGE, EDGE MSC12, UMTS, HSDPA, HSPA+ 21.1, HSPA+ 42.2, DC-HSDPA 42.2, HSUPA, HSUPA 5.8, LTE 100/50, LTE 150/50, LTE 300/75, LTE 300/50, LTE 300/100, LTE 450/50, LTE 450/100, LTE 600/50, LTE 600/100, LTE 400/150, LTE 1000/100, LTE 1600, LTE 1200/200, LTE 2000/300","Nano-SIM (4FF)","Internal antenna","Samsung Exynos 2100 ModAP","Capacitive multi-touch","10-point","","No","No","No","No","","No","No","","No","No","No","USB 3.1","USB HS (480 Mbps), USB SS (5 Gbps)","USB Host, USB OTG 1.3, USB OTG 2.0, USB PD, USB charging, USB PD 2.0, USB PD 3.0, USB fast charging","USB C reversible","25","No","No","No","No","No","No","No","No","Bluetooth 5.0","A2DP, AVRCP, DIP, GAVDP, HFP, HID, HSP, OPP, PAN, PBA, SPP, SAP, A2DP aptX, MAP, A2DP aptX HD","","802.11a, 802.11b, 802.11g, 802.11n, 802.11ac, 802.11ax","Wi-Fi Direct, Wi-Fi Tethering, DLNA, Miracast, WiDi, Wi-Fi Calling","","No","NFC A, NFC B","No","No","No","No","No","No","No","No","GPS","","Internal antenna","A-GPS, QuickGPS, Dual-frequency GPS, Geotagging, Simultaneous GPS, QZSS","FDMA, CDMA","Open access, Commercial","BeiDou-1, BeiDou-2","Samsung Exynos 2100 ModAP","Rear","Samsung ISOCELL Plus S5K2LD","BSI CMOS","1/1.76","1.8","4032x3024","12.2","f/1.80","","2.2","13.5","PD AF","","","JPG, HEIF","7680x4320","24","3G2, HEVC","single LED","Macro mode, EIS, EIS (video), Face detection, Smile detection, Touch focus, OIS, Panorama Photo, HDR photo, HDR video, Refocus, Red-eye reduction, Slow motion video, Face tagging, Face retouch, Face retouch (video), Burst mode, Intelligent scene detection","","BSI CMOS","","1.4","12.2","f/2.20","13","No","EIS (video), Face detection, Smile detection, Panorama Photo, HDR photo, HDR video, Slow motion video, Face tagging, Face retouch, Face retouch (video), Burst mode, Intelligent scene detection","BSI CMOS","0.8","1/1.72","64.4","f/2.00","29","PD AF","OIS, Panorama Photo, HDR photo, Burst mode, Intelligent scene detection, Pixel unification","No","0","0.0","","","No","No","No","0.0","0","","No","No","Front","","BSI CMOS","1/3.24","1.22","3648x2736","10.0","f/2.20","PD AF","26","JPG, HEIF","","30","3GP, 3G2, HEVC","No","Face detection, Smile detection, Touch focus, Panorama Photo, HDR photo, HDR video, Slow motion video, Face tagging, Face retouch, Face retouch (video), Burst mode, Intelligent scene detection, Pixel unification","No","0","0.0","","No","0.0","","3D","3D","3D","L sensor, P sensor, Barometer, Hall, HR sensor, Step counter, In-screen FP sensor","No","6 Totally protected from dust ","8 Protected against immersion beyond 1m of depth","","30","150","No","Li-ion","built-in","","1","3.88","4000","0","","3.88","4000","15.52","15","267","","","33","121","","Qi, PMA","15","Hungary, Italy, Germany, Austria, Spain, Portugal, France, UK, Ireland, Netherlands, Belgium, Norway, Sweden, Finland, Poland, Romania, Russia, Greece, India, Taiwan, Indonesia, Australia, Pakistan, Saudi Arabia, Switzerland, NZ, Denmark, Malaysia, Singapore, UAE, HK, Thailand, South Africa, Vietnam, Philippines, Israel, Iran, Kuwait, Kazakhstan, Slovakia, Slovenia, Czech, Latvia, Ukraine, Croatia, Jordan, Bulgaria,  Egypt, Sri Lanka, Myanmar, Kenya, Algeria, Bangladesh, Nepal, Tunisie, Belarus, Morocco","Europe, Eastern Europe, Western Europe, Asia, Middle East , Southeast Asia, Africa, South America, Australia, Oceania","","899","EUR","samsung_galaxy_s21.jpg","Final","2021-05-20 10:59","18334"
"Apple","iPad 10.2-inch 2020 8th gen TD-LTE CN 32GB","A2430","Apple iPad 11,7","J172aAP","The most affordable iPad 8 for China with different LTE bands, only nano-SIM support and 3 / 32 GB memory","2020 Oct","2020 Sep","Apple","Foxconn","Apple iPad 10.2-inch 2019 7th gen A2198 TD-LTE CN 32GB / A2199 (Apple iPad 7,12)","Active stylus","Tablet","iBeacon, Lightning connector port, HT80, optional active stylus (Apple Pencil, 1st gen), 720p 120 fps slow-motion video recording","174.1","6.85","250.6","9.87","7.5","0.3","","327.2","495","17.46","iOS / iPadOS","Apple iPadOS 14","","","Voice Command, Navigation software, Augmented Reality (AR), Intelligent personal assistant","2496","Apple A12 Bionic APL1081 / APL1W81 (T8020)","LPDDR4x SDRAM","","3072","","","Flash EEPROM","Any","","30518","","","No","","","","","","259","10.2","1620x2160","3499200","155.4","6.12","207.2","8.16","18.7","32198.9","73.8","0.09593","265","Color IPS TFT LCD","Retina Display","24","16.8M","8","LED","Any","RGB Matrix","60","Any","","","","","","","","","","","","","No","No","","","","No","No","No","No","Apple A12MP4","","","","Any","Proprietary","No","1920x1080 (1080p)","No","stereo","","","","stereo","No","24","48000","stereo","","3.5mm","GSM850, GSM900, GSM1800, GSM1900, UMTS850 (B5), UMTS900 (B8), UMTS1700/2100 (B4), UMTS1900 (B2), UMTS2100 (B1), LTE2100 (B1), LTE700 (B17), LTE700 (B13), LTE1700/2100 (B4), LTE850 (B5), LTE1800 (B3), LTE2600 (B7), LTE1900 (B2), LTE1500 (B11), LTE800 (B18), LTE900 (B8), LTE800 (B20), LTE1900 (B25), LTE700 (B12), LTE850 (B26), LTE800 (B19), LTE1500 (B21), TD-LTE2500 (B41), TD-LTE2600 (B38), TD-LTE2300 (B40), TD-LTE1900 (B39), LTE700 (B28), LTE700 (B29), LTE2300 (B30), LTE1700/2100 (B66), LTE700 (B14), TD-LTE2000 (B34)","GPRS, EDGE, UMTS, HSDPA, HSPA+ 21.1, DC-HSDPA 42.2, HSUPA, HSUPA 5.8, LTE, LTE 100/50, LTE 150/50, LTE 300/50","Nano-SIM (4FF)","Internal antenna","","No","No","","0","No","No","0","No","No","0","No","No","0","No","No","0","No","No","No","No","No","No","No","","Capacitive multi-touch","10-point","","No","No","Attachable QWERTY","No","","No","No","","No","No","No","USB 3.0","USB HS (480 Mbps), USB SS (5 Gbps)","USB Host, USB OTG 1.3, USB OTG 2.0, USB PD, USB charging","Proprietary","0","No","No","No","No","No","No","No","No","Bluetooth 4.2","A2DP, AVRCP, A2DP aptX","","802.11a, 802.11b, 802.11g, 802.11n, 802.11ac","AirPlay, Wi-Fi Calling","","No","NFC A, NFC B","No","No","No","No","No","No","No","No","GPS","","Internal antenna","A-GPS, QuickGPS, Geotagging, Simultaneous GPS","Any","No","No","Apple A12","Rear","","BSI CMOS","","0","3264x2448","8.0","f/2.40","","1","3","CD AF","","","JPG","1920x1080","30","3G2","No","Macro mode, EIS, EIS (video), Face detection, Touch focus, Panorama Photo, HDR photo, HDR video, Slow motion video, Burst mode","","No","","0","0.0","","","No","No","No","0","","0.0","","","No","No","No","0","0.0","","","No","No","No","0.0","0","","No","No","Front","","BSI CMOS","","0","1280x960","1.2","f/2.40","No","","JPG","1280x720","30","3G2","No","Face detection, HDR photo, HDR video, Burst mode","No","0","0.0","","No","0.0","","Any","3D","3D","L sensor, Barometer, FP sensor","No","Any","Any","","","","No","Li-ion polymer (LiPo)","built-in","","1","3.73","8686","0","","3.73","8686","32.4","9","965","","","0","","","No","0","China","Asia","","3499","CNY","apple_ipad_102_2020_lte_2.jpg","Final","2020-10-06 08:42","17505"
"Xiaomi","Redmi 9T Standard Edition Dual SIM TD-LTE RU 128GB","M2010J19SY","Xiaomi Lime","","Lower mid-range Redmi product for Eastern Europe and Asia with 6.53-inch IPS screen, IR port, 3 card slots (2x nano-SIM + microSD), side fingerprint sensor, NFC, 4 GiB of RAM, 128 GB UFS 2.2 ROM, auto-cleaning stereo speakers and 6 Ah battery","2021 Jan","2021 Jan 8","Xiaomi","","","Haptic touch feedback","Smartphone","720p 120 fps slow-motion video recording","77.3","3.04","162.3","6.39","9.6","0.38","","120.4","198","6.98","Android","Google Android 10 (Q)","MIUI 12","","Voice Command, Navigation software, Intelligent personal assistant, Face Recognition","2000","Qualcomm Snapdragon 662 SM6115","LPDDR4x SDRAM","1866","4096","","","Flash EEPROM","UFS 2.2","","122070","","","No","","","","1","","165.8","6.5","1080x2340","2527200","69.48","2.74","150.54","5.93","7.82","10459.5","83.4","0.06433","395","Color IPS TFT LCD","No","24","16.8M","8","LED","Any","Any","","Gorilla Glass 3","","","","","","","","","","","","","No","No","","","","No","No","No","No","Qualcomm Adreno 610","0.5","950","","No","No","No","No","No","stereo","","","","stereo","No","","","stereo","","3.5mm","GSM850, GSM900, GSM1800, GSM1900, UMTS850 (B5), UMTS900 (B8), UMTS1700/2100 (B4), UMTS1900 (B2), UMTS2100 (B1), LTE2100 (B1), LTE1700/2100 (B4), LTE850 (B5), LTE1800 (B3), LTE2600 (B7), LTE1900 (B2), LTE800 (B18), LTE900 (B8), LTE800 (B20), LTE850 (B26), LTE800 (B19), TD-LTE2500 (B41), TD-LTE2600 (B38), TD-LTE2300 (B40), LTE700 (B28)","GPRS, EDGE, UMTS, HSDPA, HSPA+ 21.1, DC-HSDPA 42.2, HSUPA, HSUPA 5.8, HSUPA 11.5, LTE, LTE 100/50, LTE 150/50, LTE 300/50, LTE 600/50","Nano-SIM (4FF)","Internal antenna","64","No","Voice transmission, Voice speaker, Vibrate, Speakerphone, ANC, HD Voice, VoLTE","Qualcomm SM6115","0","No","No","0","No","No","0","No","No","0","No","No","0","No","No","Dual standby","GSM850, GSM900, GSM1800, GSM1900, UMTS850 (B5), UMTS900 (B8), UMTS1700/2100 (B4), UMTS1900 (B2), UMTS2100 (B1), LTE2100 (B1), LTE1700/2100 (B4), LTE850 (B5), LTE1800 (B3), LTE2600 (B7), LTE1900 (B2), LTE800 (B18), LTE900 (B8), LTE800 (B20), LTE850 (B26), LTE800 (B19), TD-LTE2500 (B41), TD-LTE2600 (B38), TD-LTE2300 (B40), LTE700 (B28)","GPRS, EDGE, UMTS, HSDPA, HSPA+ 21.1, DC-HSDPA 42.2, HSUPA, HSUPA 5.8, HSUPA 11.5, LTE, LTE 100/50, LTE 150/50, LTE 300/50, LTE 600/50","Nano-SIM (4FF)","Internal antenna","Qualcomm SM6115","Capacitive multi-touch","10-point","","No","No","No","No","","No","No","","No","No","microSD, microSDHC, TransFlash, microSDXC","USB 2.0","USB HS (480 Mbps)","USB Host, USB OTG 1.3, USB PD, USB charging, USB fast charging","USB C reversible","18","No","No","No","No","No","No","No","No","Bluetooth 5.0","A2DP, AVRCP, GAVDP, HFP, HID, HSP, PAN, PBA, A2DP aptX, MAP, A2DP aptX HD","","802.11a, 802.11b, 802.11g, 802.11n, 802.11ac","Wi-Fi Tethering, WiDi, Wi-Fi Calling","","No","NFC A, NFC B","Any","No","No","FM radio (76-108 MHz)","Proprietary headset","No","No","No","GPS","","Internal antenna","A-GPS, QuickGPS, Geotagging, Simultaneous GPS, NavIC","Any","Any","BeiDou-2","Qualcomm SM6115","Rear","","BSI CMOS","1/2.00","0.8","8000x6000","48.0","f/1.79","","1","10","PD AF","","","JPG","1920x1080","30","MPEG4","single LED","Face detection, Smile detection, Touch focus, Panorama Photo, HDR photo, HDR video, Red-eye reduction, Slow motion video, Face tagging, Face retouch, Face retouch (video), Burst mode, Intelligent scene detection, Pixel unification","","BSI CMOS","","1.12","8.0","f/2.20","","No","Face detection, Smile detection, Panorama Photo, Face tagging, Burst mode","CMOS","1.75","","1.9","f/2.40","","No","Macro mode, Burst mode","Mono CMOS","1.75","1.9","f/2.40","","No","No","No","0.0","0","","No","No","Front","","BSI CMOS","1/4.00","1.12","3264x2448","8.0","f/2.05","No","","JPG","1920x1080","30","MPEG4","No","Face detection, Smile detection, Panorama Photo, HDR photo, Face tagging, Face retouch, Intelligent scene detection","No","0","0.0","","No","0.0","","Any","Any","No","L sensor, P sensor, FP sensor","No","Any","Any","","","","No","Li-ion","built-in","","1","3.87","6000","0","","3.87","6000","23.22","14","359","695","9","45","133","","No","0","Poland, Russia, Greece, Latvia, Ukraine","Europe, Eastern Europe, Asia","","16990","RUB","xiaomi_redmi_9t.jpg","Final","2021-04-17 21:29","18253"
"Xiaomi","Redmi 9 Power 4G Premium Edition Dual SIM TD-LTE IN 128GB","M2010J19SI","Xiaomi Lime","","Lower mid-range smartphone for India with Snapdragon 662 CPU, IR port, 3 card slots (2x nano-SIM + microSD), side fingerprint sensor, 6 GiB of RAM, 128 GB UFS 2.2 ROM, auto-cleaning stereo speakers and 6000 mAh battery","2020 Dec","2020 Dec 18","Xiaomi","Rising Stars Mobile India","","Haptic touch feedback","Smartphone","720p 120 fps slow-motion video recording","77.3","3.04","162.3","6.39","9.6","0.38","","120.4","198","6.98","Android","Google Android 10 (Q)","MIUI 12","","Voice Command, Navigation software, Intelligent personal assistant, Face Recognition","2000","Qualcomm Snapdragon 662 SM6115","LPDDR4x SDRAM","1866","6144","","","Flash EEPROM","UFS 2.2","","122070","","","No","","","","1","","165.8","6.5","1080x2340","2527200","69.48","2.74","150.54","5.93","7.82","10459.5","83.4","0.06433","395","Color IPS TFT LCD","No","24","16.8M","8","LED","Any","Any","","Gorilla Glass 3","","","","","","","","","","","","","No","No","","","","No","No","No","No","Qualcomm Adreno 610","0.5","950","","No","No","No","No","No","stereo","","","","stereo","No","","","stereo","","3.5mm","GSM850, GSM900, GSM1800, GSM1900, UMTS850 (B5), UMTS900 (B8), UMTS2100 (B1), LTE2100 (B1), LTE850 (B5), LTE1800 (B3), LTE900 (B8), TD-LTE2500 (B41), TD-LTE2300 (B40)","GPRS, EDGE, UMTS, HSDPA, HSPA+ 21.1, DC-HSDPA 42.2, HSUPA, HSUPA 5.8, HSUPA 11.5, LTE, LTE 100/50, LTE 150/50, LTE 300/50, LTE 600/50","Nano-SIM (4FF)","Internal antenna","64","No","Voice transmission, Voice speaker, Vibrate, Speakerphone, ANC, HD Voice, VoLTE","Qualcomm SM6115","0.868","US","No","0.865","US","No","0","No","No","0","No","No","0","No","No","Dual standby","GSM850, GSM900, GSM1800, GSM1900, UMTS850 (B5), UMTS900 (B8), UMTS2100 (B1), LTE2100 (B1), LTE850 (B5), LTE1800 (B3), LTE900 (B8), TD-LTE2500 (B41), TD-LTE2300 (B40)","GPRS, EDGE, UMTS, HSDPA, HSPA+ 21.1, DC-HSDPA 42.2, HSUPA, HSUPA 5.8, HSUPA 11.5, LTE, LTE 100/50, LTE 150/50, LTE 300/50, LTE 600/50","Nano-SIM (4FF)","Internal antenna","Qualcomm SM6115","Capacitive multi-touch","10-point","","No","No","No","No","","No","No","","No","No","microSD, microSDHC, TransFlash, microSDXC","USB 2.0","USB HS (480 Mbps)","USB Host, USB OTG 1.3, USB PD, USB charging, USB fast charging","USB C reversible","18","No","No","No","No","No","No","No","No","Bluetooth 5.0","A2DP, AVRCP, GAVDP, HFP, HID, HSP, PAN, PBA, A2DP aptX, MAP, A2DP aptX HD","","802.11a, 802.11b, 802.11g, 802.11n, 802.11ac","Wi-Fi Tethering, WiDi, Wi-Fi Calling","","No","No","Any","No","No","FM radio (76-108 MHz)","Proprietary headset","No","No","No","GPS","","Internal antenna","A-GPS, QuickGPS, Geotagging, Simultaneous GPS, NavIC","Any","Any","BeiDou-2","Qualcomm SM6115","Rear","","BSI CMOS","","0.8","8000x6000","48.0","f/1.79","","1","10","PD AF","","","JPG","1920x1080","30","MPEG4","single LED","Face detection, Smile detection, Touch focus, Panorama Photo, HDR photo, HDR video, Red-eye reduction, Slow motion video, Face tagging, Face retouch, Face retouch (video), Burst mode, Intelligent scene detection, Pixel unification","","BSI CMOS","","1.12","8.0","f/2.20","","No","Face detection, Panorama Photo, Face tagging, Burst mode","CMOS","1.75","","1.9","f/2.40","","No","Macro mode, Burst mode","Mono CMOS","1.75","1.9","f/2.40","","No","No","No","0.0","0","","No","No","Front","","BSI CMOS","","1.12","3264x2448","8.0","f/2.05","No","","JPG","1920x1080","30","MPEG4","No","Face detection, Smile detection, Panorama Photo, HDR photo, Face tagging, Face retouch, Intelligent scene detection","No","0","0.0","","No","0.0","","Any","Any","No","L sensor, P sensor, FP sensor","No","Any","Any","","","","No","Li-ion","built-in","","1","0","6000","0","","0","6000","0","14","359","695","9","45","133","","No","0","India","Asia","","16990","INR","xiaomi_redmi_9_power.jpg","Final","2021-04-17 21:08","18252"
"Samsung","Galaxy M31 Prime Edition Global Dual SIM TD-LTE 128GB","SM-M315F/DS","Samsung M315","M315FLBGINU","Mid-range dual SIM device for India with with amazon prime membership","2020 Oct","2020 Oct 14","Samsung Electronics","Samsung Electronics","","Haptic touch feedback","Smartphone","Infinity-U Display, Live Focus, Dolby Atmos sound, 720p 240 fps video recording","75.1","2.96","159.2","6.27","8.9","0.35","","106.4","191","6.74","Android","Google Android 10 (Q)","One UI 2.0","","Voice Command, Navigation software, Face Recognition","2300","Samsung Exynos 9 Octa 9611","LPDDR4x SDRAM","1600","6144","","","Flash EEPROM","UFS 2.1","","122070","","","No","","","","1","","162.1","6.4","1080x2340","2527200","67.93","2.67","147.18","5.79","7.17","9997.9","83.6","0.0629","404","AM-OLED","Super AM-OLED","24","16.8M","8","Self-illuminating","Any","RGBG PenTile Matrix","","Gorilla Glass 3","Samsung","","","","","","","","","","","","No","No","","","","No","No","No","No","ARM Mali-G72MP3","","","","No","No","No","No","No","stereo","","","","stereo","No","","","mono","","3.5mm","GSM850, GSM900, GSM1800, GSM1900, UMTS850 (B5), UMTS900 (B8), UMTS1700/2100 (B4), UMTS1900 (B2), UMTS2100 (B1), LTE2100 (B1), LTE700 (B17), LTE700 (B13), LTE1700/2100 (B4), LTE850 (B5), LTE1800 (B3), LTE2600 (B7), LTE1900 (B2), LTE900 (B8), LTE800 (B20), LTE700 (B12), LTE850 (B26), TD-LTE2500 (B41), TD-LTE2600 (B38), TD-LTE2300 (B40), LTE700 (B28), LTE1700/2100 (B66)","GPRS, GPRS MSC33, EDGE, UMTS, HSDPA, HSPA+ 21.1, DC-HSDPA 42.2, HSUPA, HSUPA 5.8, LTE, LTE 100/50, LTE 150/50, LTE 300/50","Nano-SIM (4FF)","Internal antenna","64","No","Voice transmission, Voice speaker, Vibrate, Speakerphone, ANC, HD Voice, VoLTE","Samsung Exynos 9611 ModAP","0.383","US","No","0","No","No","0","No","No","0","No","No","0","No","No","Dual standby","GSM850, GSM900, GSM1800, GSM1900, UMTS850 (B5), UMTS900 (B8), UMTS1700/2100 (B4), UMTS1900 (B2), UMTS2100 (B1), LTE2100 (B1), LTE700 (B17), LTE700 (B13), LTE1700/2100 (B4), LTE850 (B5), LTE1800 (B3), LTE2600 (B7), LTE1900 (B2), LTE900 (B8), LTE800 (B20), LTE700 (B12), LTE850 (B26), TD-LTE2500 (B41), TD-LTE2600 (B38), TD-LTE2300 (B40), LTE700 (B28), LTE1700/2100 (B66)","GPRS, EDGE, UMTS, HSDPA, HSPA+ 21.1, DC-HSDPA 42.2, HSUPA, HSUPA 5.8, LTE, LTE 100/50, LTE 150/50, LTE 300/50","Nano-SIM (4FF)","Internal antenna","Samsung Exynos 9611 ModAP","Capacitive multi-touch","10-point","","No","No","No","No","","No","No","","No","No","microSD, microSDHC, TransFlash, microSDXC","USB 2.0","USB HS (480 Mbps)","USB Host, USB OTG 1.3, USB PD, USB charging, USB fast charging","USB C reversible","15","No","No","No","No","No","No","No","No","Bluetooth 5.0","A2DP, AVRCP, DIP, HCRP, HFP, HID, HSP, OPP, PAN, PBA, A2DP aptX, MAP","","802.11a, 802.11b, 802.11g, 802.11n, 802.11ac","Wi-Fi Direct, Wi-Fi Tethering","","No","No","No","No","No","FM radio (76-108 MHz) with RDS","Proprietary headset","No","No","No","GPS","","Internal antenna","A-GPS, QuickGPS, Geotagging, Simultaneous GPS","Any","Any","BeiDou-2","Samsung Exynos 9611 ModAP","Rear","Samsung ISOCELL GW1","BSI CMOS","1/1.72","0.8","9280x6944","64.4","f/1.80","","1","8","PD AF","","","JPG","3840x2160","30","MPEG4","single LED","Macro mode, Face detection, Smile detection, Touch focus, Panorama Photo, HDR photo, HDR video, Red-eye reduction, Slow motion video, Face tagging, Face retouch, Burst mode, Intelligent scene detection, Pixel unification","","CMOS","","0","8.0","f/2.20","","No","Macro mode, Face detection, Smile detection, HDR photo, Face tagging, Burst mode, Intelligent scene detection","CMOS","0","","4.9","f/2.40","","No","Macro mode, HDR photo, Burst mode","CMOS","0","4.9","","","No","No","No","0.0","0","","No","No","Front","","BSI CMOS","","0","6528x4896","32.0","f/2.00","Unknown","","JPG","","","3GP","No","Face detection, Smile detection, Panorama Photo, HDR photo, HDR video, Face tagging, Face retouch, Face retouch (video), Burst mode, Intelligent scene detection","No","0","0.0","","No","0.0","","Any","Any","Any","L sensor, P sensor, FP sensor","No","Any","Any","","","","No","Li-ion","built-in","","1","0","6000","0","","0","6000","0","21","286","","","48","125","","No","0","India","Asia","","18499","INR","samsung_galaxy_m31_2020.jpg","Final","2021-01-26 11:45","18020"
