"Apple","iPhone 12 Mini 5G Global Dual SIM TD-LTE 256GB","A2399","Apple iPhone 13,1","D52gAP","Compact smartphone which shares most of its high-end features with more expensive and larger siblings in the 12 / 12 Pro model range, like A14 Bionic SoC, XDR AMOLED display, 12 MP wide, 12 MP ultra-wide, 12 MP front cameras. Global 4 / 256 GB variant","2020 Nov 12","2020 Oct 13","Apple","Foxconn","Apple iPhone 8 A1863 TD-LTE 256GB (Apple iPhone 10,1)","Haptic touch feedback, Tactile touch feedback","Smartphone","NFC (Apple Pay), 1080p 240fps video capture, Lightning connector port, HDR10 support, DCI-P3, TrueDepth selfie camera, Dolby Vision","64.2","2.53","131.5","5.18","7.4","0.29","","62.5","133","4.69","iOS / iPadOS","Apple iOS 14.1","","","Voice Command, Navigation software, Augmented Reality (AR), Intelligent personal assistant, Voice Recognition, Face Recognition","2990","Apple A14 Bionic APL1001 / APL1W01","LPDDR4 SDRAM","2133","4096","","Micron MT53D512M64D4UA-046","Flash EEPROM","Any","","244140","","","No","","","","1","","137.67","5.4","1080x2340","2527200","57.69","2.27","125","4.92","6.51","7211.4","85.4","0.05342","475","AM-OLED","Super Retina XDR","30","1073.7M","10","Self-illuminating","Any","Any","60","Ceramic shield","","","","","","","","","","","","","No","No","","","","No","No","No","No","Apple A14MP4","","","","Any","Proprietary","No","1920x1080 (1080p)","No","stereo","","","","3","Proprietary","","","stereo","","Proprietary","GSM850, GSM900, GSM1800, GSM1900, CDMA800 (BC0), CDMA1900 (BC1/BC14), UMTS850 (B5), UMTS900 (B8), UMTS1700/2100 (B4), UMTS1900 (B2), UMTS2100 (B1), LTE2100 (B1), LTE700 (B17), LTE700 (B13), LTE1700/2100 (B4), LTE850 (B5), LTE1800 (B3), LTE2600 (B7), LTE1900 (B2), LTE800 (B18), LTE900 (B8), LTE800 (B20), LTE1900 (B25), LTE700 (B12), LTE850 (B26), LTE800 (B19), TD-LTE2500 (B41), TD-LTE2600 (B38), TD-LTE2300 (B40), TD-LTE1900 (B39), LTE700 (B28), LTE2300 (B30), TD-LTE3500 (B42), LTE1500 (B32), LTE1700/2100 (B66), TD-LTE5900  (B46), TD-LTE3600  (B48), TD-LTE2000 (B34), NR800 (N20), TD-NR2500 (N41), TD-NR3700 (N77), TD-NR3500 (N78), TD-NR4700 (N79), NR 700 (N12), NR2100 (N1), NR1800 (N3), NR1900 (N2), NR700 (N28), TD-NR2600 (N38), NR850 (N5), NR2600 (N7), NR900 (N8), TD-NR2300 (N40), NR1700/2100 (N66), NR1900 (N25)","GPRS, EDGE, UMTS, HSDPA, HSPA+ 21.1, DC-HSDPA 42.2, HSUPA, HSUPA 5.8, cdmaOne, CDMA2000 1x, CDMA2000 1xEV-DO, CDMA2000 1xEV-DO Rev A, LTE, LTE 100/50, LTE 150/50, LTE 300/75, LTE 300/50, LTE 450/50, LTE 450/100, LTE 600/50, LTE 600/100, LTE 400/150, LTE 1000/100, LTE 1600, NR 2600, NR 1500","e-SIM","Internal antenna","128","M3, T4","Voice transmission, Voice speaker, Vibrate, Speakerphone, ANC, HD Voice, VoLTE, ViLTE","Qualcomm Snapdragon X55M","1.19","US","No","1.19","US","No","0","No","No","0.98","EU","No","0.99","EU","No","Dual standby","GSM850, GSM900, GSM1800, GSM1900, CDMA800 (BC0), CDMA1900 (BC1/BC14), UMTS850 (B5), UMTS900 (B8), UMTS1700/2100 (B4), UMTS1900 (B2), UMTS2100 (B1), LTE2100 (B1), LTE700 (B17), LTE700 (B13), LTE1700/2100 (B4), LTE850 (B5), LTE1800 (B3), LTE2600 (B7), LTE1900 (B2), LTE800 (B18), LTE900 (B8), LTE800 (B20), LTE1900 (B25), LTE700 (B12), LTE850 (B26), LTE800 (B19), TD-LTE2500 (B41), TD-LTE2600 (B38), TD-LTE2300 (B40), TD-LTE1900 (B39), LTE700 (B28), LTE2300 (B30), TD-LTE3500 (B42), LTE1500 (B32), LTE1700/2100 (B66), TD-LTE5900  (B46), TD-LTE3600  (B48), TD-LTE2000 (B34)","GPRS, EDGE, UMTS, HSDPA, HSPA+ 21.1, DC-HSDPA 42.2, HSUPA, HSUPA 5.8, cdmaOne, CDMA2000 1x, CDMA2000 1xEV-DO, CDMA2000 1xEV-DO Rev A, LTE 100/50, LTE 150/50, LTE 300/75, LTE 300/50, LTE 300/100, LTE 450/50, LTE 450/100, LTE 600/50, LTE 600/100, LTE 400/150, LTE 1000/100, LTE 1600","Nano-SIM (4FF)","Internal antenna","","Capacitive multi-touch","10-point","120","No","No","No","No","","No","No","","No","No","No","USB 3.1","USB HS (480 Mbps), USB SS (5 Gbps)","USB charging, USB fast charging","Proprietary","20","No","No","No","No","No","No","No","No","Bluetooth 5.0","A2DP, AVRCP, HFP, HID, PAN, PBA, A2DP aptX, MAP, A2DP aptX HD","USI 339S00761","802.11a, 802.11b, 802.11g, 802.11n, 802.11ac, 802.11ax","UMA, Wi-Fi Calling","USI 339S00761","No","NFC A, NFC B","No","No","No","No","No","No","No","No","GPS","","Internal antenna","A-GPS, QuickGPS, Geotagging, Simultaneous GPS, QZSS","Any","Any","BeiDou-2","","Rear","","BSI CMOS","","1.4","4032x3024","12.2","f/1.60","","2","5","PD AF","26","","JPG, RAW, HEIF","3840x2160","60","3G2, HEVC","quad LED","Macro mode, EIS (video), Face detection, Smile detection, Touch focus, OIS, Panorama Photo, HDR photo, HDR video, Red-eye reduction, Slow motion video, Face tagging, Face retouch, OIS (video), Burst mode, Intelligent scene detection","","BSI CMOS","","1","12.2","f/2.40","13","No","Face detection, Smile detection, Touch focus, Panorama Photo, HDR photo, HDR video, Slow motion video, Face tagging, Burst mode, Intelligent scene detection","No","0","","0.0","","","No","No","No","0","0.0","","","No","No","No","0.0","0","","No","No","Front","","BSI CMOS","1/3.60","1","4032x3024","12.2","f/2.20","No","23","JPG, HEIF","3840x2160","60","3G2, HEVC","No","EIS, EIS (video), Face detection, Smile detection, Panorama Photo, HDR photo, HDR video, Slow motion video, Face retouch, Burst mode","Mono CMOS","0","0.0","","No","0.0","","3D","3D","3D","L sensor, P sensor, Barometer, Step counter","No","6 Totally protected from dust ","8 Protected against immersion beyond 1m of depth","","30","600","No","Li-ion","built-in","","1","3.85","2227","0","","3.85","2227","8.57","13","","","","0",""," Apple APL1094","Qi, MagSafe","15","Hungary, Italy, Germany, Austria, Spain, Portugal, France, UK, Ireland, Netherlands, Belgium, Norway, Sweden, Finland, Poland, Romania, Russia, Greece, Turkey, South Korea, India, Taiwan, Indonesia, Australia, Mexico, Brazil, Chile, Argentina, Costa Rica, Pakistan, Saudi Arabia, Switzerland, Uzbekistan, Puerto Rico, NZ, Denmark, Malaysia, Singapore, UAE, HK, Thailand, South Africa, Vietnam, Philippines, Israel, Serbia, Kuwait, Kazakhstan, Slovakia, Slovenia, Czech, Latvia, Ukraine, Croatia, Jordan, Peru, Bulgaria, Ecuador, Panama, Colombia,  Egypt, Sri Lanka, Myanmar, Tanzania, Kenya, Algeria, Cambodia, Bangladesh, Nepal, Tunisie, Belarus, Guatemala, Bolivia, Morocco, Lebanon","Worldwide, Europe, Eastern Europe, Western Europe, Asia, Middle East , Southeast Asia, Africa, North America, South America, Central America, Australia, Oceania","A1 Bulgaria, A1 Slovenija, A1 Telekom Austria, A1 Vipnet, Asia Pacific Telecom, AT&T Mexico Mobility, Base Belgium, Bell Mobility, Bharti Airtel Limited India, Bouygues Telecom, Chunghwa Telecom , DNA Oyj, EE Limited UK, Etisalat UAE, FarEasTone Telecommunications, Free Mobile FR, Hutchison Drei Austria, Hutchison Three UK, Kcell JSC, KPN Mobile, Movistar Mexico / Pegaso, Movistar Spain, MTS Russia, O2 Czech Republic, O2 Germany, O2 United Kingdom, Orange Belgium, Orange France, Orange Polska, Orange Romania, Orange Slovakia, Orange United Kingdom, Polkomtel Plus, Proximus Belgacom Mobile, Reliance Communications, S Mobility Limited , Salt Mobile SA / Orange CH, Saudi Telecom Company, SFR, SingTel Optus Pty Limited, Sunrise Communications AG, Swisscom AG, T-Mobile Austria, T-Mobile Czech Republic, T-Mobile Nederland, T-Mobile Polska, Taiwan Mobile, Taiwan Star Telecom Corporation Limited, TELCEL, Telecom Italia, Telekom Croatia, Telekom Deutschland, Telekom Hungary, Telekom Romania, Telekom Slovakia, Telekom Slovenije, Telenor Bulgaria, Telenor Hungary, Telenor Norway, Telia Finland, Telia Norway, Telstra Corporation Limited, Virgin Mobile Canada, Virgin Mobile United Kingdom, Vodafone Australia, Vodafone Czech Republic, Vodafone Germany, Vodafone Hungary, Vodafone India, Vodafone Italia, Vodafone Netherlands, Vodafone Romania, Vodafone Spain, Vodafone Turkey, Vodafone United Kingdom, WIND Hellas, Wind Tre Italia","849","GBP","apple_iphone12_mini.jpg","Final","2020-10-18 22:31","17576"
"BBK","Vivo Y20 2021 Dual SIM TD-LTE V2 MY BD 64GB","","BBK V2043","","AI Triple Macro Camera is supported by a wide range of features, including Face Beauty, Portrait Light effects and filters. The triple card slot supports memory expansion of up to 256GB","2021 Jan 4","2021 Jan 3","BBK Electronics","BBK Electronics","BBK Vivo Y19 2019 Dual SIM TD-LTE MY NP BD 128GB 1915 (BBK V1934)","Haptic touch feedback","Smartphone","","76.32","3","164.41","6.47","8.41","0.33","","105.5","192","6.77","Android","Google Android 11 (R)","Funtouch OS 11","","Voice Command, Navigation software, Intelligent personal assistant, Face Recognition","2300","MediaTek Helio P35 MT6765","LPDDR4x SDRAM","1600","4096","3809","","Flash EEPROM","eMMC 5.1","","61035","","","No","","","","","1","165.35","6.5","720x1600","1152000","67.85","2.67","150.79","5.94","8.47","10231.4","81.5","0.09424","270","Color IPS TFT LCD","No","24","16.8M","8","LED","transflective","RGB Matrix","","Any","","","","","","","","","","","","","No","No","","","","No","No","No","No","PowerVR GE8320","","600","","No","No","No","No","No","stereo","","","","stereo","No","","","mono","","3.5mm","GSM850, GSM900, GSM1800, UMTS850 (B5), UMTS900 (B8), UMTS2100 (B1), LTE2100 (B1), LTE850 (B5), LTE1800 (B3), LTE2600 (B7), LTE900 (B8), TD-LTE2500 (B41), TD-LTE2600 (B38), TD-LTE2300 (B40)","GPRS, EDGE, UMTS, HSDPA, HSPA+ 21.1, HSUPA, LTE, LTE 100/50, LTE 150/50","Nano-SIM (4FF)","Internal antenna","64","No","Voice transmission, Voice speaker, Vibrate, Speakerphone, ANC, HD Voice, VoLTE","MediaTek MT6765","0","No","No","0","No","No","0","No","No","0","No","No","0","No","No","Dual standby","GSM850, GSM900, GSM1800, UMTS850 (B5), UMTS900 (B8), UMTS2100 (B1), LTE2100 (B1), LTE850 (B5), LTE1800 (B3), LTE2600 (B7), LTE900 (B8), TD-LTE2500 (B41), TD-LTE2600 (B38), TD-LTE2300 (B40)","GPRS, EDGE, UMTS, HSDPA, HSPA+ 21.1, HSUPA, HSUPA 5.8, LTE, LTE 100/50, LTE 150/50","Nano-SIM (4FF)","Internal antenna","MediaTek MT6765","Capacitive multi-touch","Any","","No","No","No","No","","No","No","","No","No","microSD, microSDHC, TransFlash, microSDXC","USB 2.0","USB HS (480 Mbps)","USB Host, USB OTG 1.3, USB PD, USB charging","USB Micro-AB","10","No","No","No","No","No","No","No","No","Bluetooth 5.0","A2DP, AVRCP, HFP, HID, HSP, OPP, PAN, A2DP aptX","","802.11a, 802.11b, 802.11g, 802.11n, 802.11ac","Wi-Fi Tethering, WiDi","","No","No","No","No","No","FM radio (76-108 MHz) with RDS","Proprietary headset","No","No","No","GPS","","Internal antenna","A-GPS, QuickGPS, Geotagging, Simultaneous GPS","Any","Any","BeiDou-2","MediaTek MT6765","Rear","","BSI CMOS","","0","4160x3120","13.0","f/2.20","","1","0","PD AF","","","JPG","1920x1080","30","MPEG4","single LED","Macro mode, Face detection, Smile detection, Touch focus, Panorama Photo, HDR photo, HDR video, Face tagging, Face retouch, Burst mode, Intelligent scene detection","","CMOS","","0","1.9","f/2.40","","No","Macro mode, HDR photo, Burst mode","Mono CMOS","0","","1.9","f/2.40","","No","No","No","0","0.0","","","No","No","No","0.0","0","","No","No","Front","","CMOS","","0","3264x2448","8.0","f/1.80","No","","JPG","1920x1080","30","3GP","No","Face detection, Smile detection, Panorama Photo, HDR photo, Face retouch","No","0","0.0","","No","0.0","","Any","Any","Any","L sensor, P sensor, FP sensor","No","Any","Any","","","","No","Li-ion polymer (LiPo)","built-in","","1","0","5000","0","","0","5000","0","0","","","","0","","","No","0","Pakistan, Malaysia, Bangladesh","Asia, Southeast Asia","","599","MYR","vivo_y20_2021.jpg","Final","2021-01-07 15:42","17918"
"Huawei","Mate 40 Pro 5G Dual SIM TD-LTE CN 512GB","NOH-AN00","Huawei Noah","","Top Chinese full netcom variant of Mate 40 Pro flagship smartphone sporting 8 GiB of RAM, 512 GB UFS 3.1 ROM and 50 + 20 + 12 MP Leica triple lens rear camera setup capable of 10x hybrid zoom","2020 Oct","2020 Oct 22","Huawei","Huawei","Huawei Mate 30 Pro 5G Dual SIM TD-LTE CN 512GB LIO-AN00 (Huawei Lion 5G)","Haptic touch feedback, Tactile touch feedback","Smartphone","Octa Phase Detection AF, HDR10+, 1080p 240fps slow-motion video recording, vapor chamber liquid cooling, GPU Turbo, Kirin Gaming+, Wi-Fi 6+","75.5","2.97","162.9","6.41","9.1","0.36","","111.9","212","7.48","Android","Google Android 10 (Q)","EMUI 11","","Voice Command, Business card recognition, Navigation software, Augmented Reality (AR), Intelligent personal assistant, Voice Recognition, Face Recognition","3130","HiSilicon Honor KIRIN9000 5G","LPDDR5 SDRAM","","8192","","","Flash EEPROM","UFS 3.1","","488281","","","No","","","","","1","171.7","6.8","1344x2772","3725568","74.91","2.95","154.5","6.08","0.59","11573.2","94.1","0.05574","456","AM-OLED","No","24","16.8M","10","Self-illuminating","Any","Any","90","Any","Samsung","","","","","","","","","","","","No","No","","","","No","No","No","No","ARM Mali-G78MP24","","","","No","No","No","No","No","stereo","","","","stereo","No","32","384000","stereo","","USB Type-C","GSM850, GSM900, GSM1800, GSM1900, CDMA800 (BC0), UMTS800 (B6), UMTS850 (B5), UMTS900 (B8), UMTS1700/2100 (B4), UMTS1900 (B2), UMTS2100 (B1), UMTS800 (B19), LTE2100 (B1), LTE700 (B17), LTE1700/2100 (B4), LTE850 (B5), LTE1800 (B3), LTE2600 (B7), LTE1900 (B2), LTE800 (B18), LTE900 (B8), LTE800 (B6), LTE1700/1800 (B9), LTE800 (B20), LTE700 (B12), LTE850 (B26), LTE800 (B19), TD-LTE2500 (B41), TD-LTE2600 (B38), TD-LTE2300 (B40), TD-LTE1900 (B39), TD-LTE3500 (B42), TD-LTE2000 (B34), TD-NR2500 (N41), TD-NR3700 (N77), TD-NR3500 (N78), TD-NR4700 (N79), NR1800 (N80), NR2100 (N1), NR1800 (N3), NR700 (N28), TD-NR2600 (N38), NR900 (N8), TD-NR2300 (N40), NR2100 (N84)","GPRS, EDGE, UMTS, HSDPA, HSPA+ 21.1, DC-HSDPA 42.2, HSUPA, HSUPA 5.8, cdmaOne, CDMA2000 1x, CDMA2000 1xEV-DO, CDMA2000 1xEV-DO Rev A, LTE, LTE 100/50, LTE 150/50, LTE 300/50, LTE 450/50, LTE 600/50, LTE 1000/100, LTE 1200/200, LTE 1400/300, NR 2600, NR 3700, NR 1500","Nano-SIM (4FF)","Internal antenna","64","No","Voice transmission, Voice speaker, Vibrate, Speakerphone, ANC, HD Voice, VoLTE","Huawei KIRIN9000 5G","0","No","No","0","No","No","0","No","No","0","No","No","0","No","No","Dual standby","GSM850, GSM900, GSM1800, GSM1900, CDMA800 (BC0), UMTS800 (B6), UMTS850 (B5), UMTS900 (B8), UMTS1700/2100 (B4), UMTS1900 (B2), UMTS2100 (B1), UMTS800 (B19), LTE2100 (B1), LTE700 (B17), LTE1700/2100 (B4), LTE850 (B5), LTE1800 (B3), LTE2600 (B7), LTE1900 (B2), LTE800 (B18), LTE900 (B8), LTE800 (B6), LTE1700/1800 (B9), LTE800 (B20), LTE700 (B12), LTE850 (B26), LTE800 (B19), TD-LTE2500 (B41), TD-LTE2600 (B38), TD-LTE2300 (B40), TD-LTE1900 (B39), TD-LTE2000 (B34)","GPRS, EDGE, UMTS, HSDPA, HSPA+ 21.1, DC-HSDPA 42.2, HSUPA, HSUPA 5.8, cdmaOne, CDMA2000 1x, CDMA2000 1xEV-DO, CDMA2000 1xEV-DO Rev A, LTE, LTE 100/50, LTE 150/50, LTE 300/50, LTE 450/50, LTE 600/50, LTE 1000/100, LTE 1200/200, LTE 1400/300","Nano-SIM (4FF)","Internal antenna","Huawei KIRIN9000 5G","Capacitive multi-touch","10-point","240","No","No","No","No","","No","No","","No","No","NM","USB 3.1","USB HS (480 Mbps), USB SS (5 Gbps)","USB Host, USB OTG 1.3, USB OTG 2.0, USB PD, USB charging, USB PD 2.0, USB PD 3.0, USB fast charging","USB C reversible","66","No","No","No","No","No","No","No","No","Bluetooth 5.2","A2DP, AVRCP, DIP, GAVDP, HFP, HID, HSP, PAN, PBA, A2DP aptX, MAP, A2DP aptX HD","","802.11a, 802.11b, 802.11g, 802.11n, 802.11ac, 802.11ax","Wi-Fi Direct, Wi-Fi Tethering, Miracast, Wi-Fi Calling","","No","NFC A, NFC B","Any","No","No","No","No","No","No","No","GPS","","Internal antenna","A-GPS, QuickGPS, Dual-frequency GPS, Geotagging, Simultaneous GPS, QZSS, NavIC","FDMA, CDMA","Open access, Commercial","BeiDou-1, BeiDou-2","Huawei KIRIN9000 5G","Rear","","BSI CMOS","1/1.28","1.22","8192x6144","50.3","f/1.90","","5","10","CD AF, Laser AF, PD AF","23","","JPG, RAW, HEIF","3840x2160","60","3GP, 3G2, HEVC","dual LED","Macro mode, EIS, EIS (video), Face detection, Smile detection, Touch focus, Panorama Photo, HDR photo, HDR video, Refocus, Red-eye reduction, Slow motion video, Face tagging, Face retouch, Face retouch (video), Burst mode, Intelligent scene detection, Pixel unification","","BSI CMOS","1/1.54","0","19.7","f/1.80","18","PD AF","Face detection, Smile detection, Panorama Photo, HDR photo, Slow motion video, Face tagging, Face retouch, Burst mode, Intelligent scene detection","BSI CMOS","0","1/3.40","12.0","f/3.40","125","PD AF","OIS, Panorama Photo, HDR photo, Burst mode, Intelligent scene detection","Mono CMOS","0","0.0","","","No","No","No","0.0","0","","No","No","Front","","BSI CMOS","","0","4160x3120","13.0","f/2.40","PD AF","18","JPG","3840x2160","60","3GP, 3G2, MPEG4","No","EIS, EIS (video), Face detection, Smile detection, Touch focus, Panorama Photo, HDR photo, HDR video, Slow motion video, Face tagging, Face retouch, Face retouch (video), Burst mode, Intelligent scene detection, Pixel unification","Mono CMOS","0","0.0","","No","0.0","","Any","3D","3D","L sensor, P sensor, Barometer, Altimeter, Hall, Gesture sensor, Step counter, In-screen FP sensor","No","6 Totally protected from dust ","8 Protected against immersion beyond 1m of depth","","","","No","Li-ion polymer (LiPo)","built-in","","1","3.85","4400","0","","3.85","4400","16.94","0","","360","12","0","","","Qi, Qi reverse","50","China","Asia","China Telecom Corporation Limited","7999","CNY","huawei_mate_40_pro_5g.jpg","Final","2021-01-12 22:17","17941"
"Motorola","Moto G8 TD-LTE APAC","XT2045-6","Motorola Rav","PAJG0004AU","The shooting mode and settings are automatically optimized according to the shooting scene. Even in ultra-wide-angle panoramic photography, ultra-macro photography, and low-light photography, you can take perfect photos.","2020 Apr 28","2020 Mar 9","Motorola Mobile Devices","Lenovo","","Haptic touch feedback","Smartphone","Dolby Audio, water-repellent coating","75.8","2.98","161.27","6.35","8.95","0.35","","109.4","188.3","6.64","Android","Google Android 10 (Q)","","","Voice Command, Navigation software, Intelligent personal assistant, Face Recognition","2000","Qualcomm Snapdragon 665 SM6125 (Trinket)","LPDDR4x SDRAM","1866","4096","3644","","Flash EEPROM","Any","","61035","","51500","No","","","","","1","162.56","6.4","720x1560","1123200","68.12","2.68","147.6","5.81","7.68","10054.7","82.3","0.09461","268","Color IPS TFT LCD","No","24","16.8M","8","LED","Any","RGB Matrix","","Any","","","","","","","","","","","","","No","No","","","","No","No","No","No","Qualcomm Adreno 610","","","","No","No","No","No","No","stereo","","","","stereo","No","","","mono","","3.5mm","GSM850, GSM900, GSM1800, GSM1900, UMTS800 (B6), UMTS850 (B5), UMTS900 (B8), UMTS1700/2100 (B4), UMTS1900 (B2), UMTS2100 (B1), UMTS800 (B19), LTE2100 (B1), LTE1700/2100 (B4), LTE850 (B5), LTE1800 (B3), LTE2600 (B7), LTE1900 (B2), LTE800 (B18), LTE900 (B8), LTE800 (B20), LTE850 (B26), LTE800 (B19), TD-LTE2500 (B41), TD-LTE2600 (B38), TD-LTE2300 (B40), LTE700 (B28)","GPRS, GPRS C12, EDGE, EDGE MSC12, UMTS, HSDPA, HSPA+ 21.1, DC-HSDPA 42.2, HSUPA, HSUPA 5.8, LTE, LTE 100/50, LTE 150/50, LTE 300/50, LTE 400/150","Nano-SIM (4FF)","Internal antenna","64","Any","Voice transmission, Voice speaker, Vibrate, Speakerphone, ANC, HD Voice, VoLTE","Qualcomm SM6125","0","No","No","0","No","No","0","No","No","0","No","No","0","No","No","No","No","No","No","No","","Capacitive multi-touch","Any","","No","No","No","No","","No","No","","No","No","microSD, microSDHC, TransFlash, microSDXC","USB 2.0","USB HS (480 Mbps)","USB Host, USB OTG 1.3, USB PD, USB charging, USB fast charging","USB C reversible","10","No","No","No","No","No","No","No","No","Bluetooth 5.0","A2DP, AVRCP, HFP, HID, HSP, PBA, A2DP aptX, MAP","","802.11b, 802.11g, 802.11n","Wi-Fi Direct, Wi-Fi Tethering, Wi-Fi Calling","","No","No","No","No","No","FM radio (76-108 MHz) with RDS","Proprietary headset","No","No","No","GPS","","Internal antenna","A-GPS, QuickGPS, Geotagging, Simultaneous GPS","Any","Any","No","Qualcomm SM6125 iZat","Rear","","BSI CMOS","","1.12","4608x3456","15.9","f/1.70","","1","8","Laser AF, PD AF","","","JPG, RAW","3840x2160","30","MPEG4","single LED","Macro mode, EIS (video), Face detection, Smile detection, Touch focus, Panorama Photo, HDR photo, HDR video, Refocus, Red-eye reduction, Slow motion video, Face tagging, Face retouch, Burst mode, Intelligent scene detection","","BSI CMOS","","1.12","8.0","f/2.20","","Laser AF","Face detection, Smile detection, Panorama Photo, HDR photo, Refocus, Face tagging, Burst mode, Intelligent scene detection","Mono CMOS","1.75","","1.9","f/2.20","","No","No","No","0","0.0","","","No","No","No","0.0","0","","No","No","Front","","CMOS","","1.12","3264x2448","8.0","f/2.00","No","","JPG","","","MPEG4","No","EIS (video), Face detection, Panorama Photo, HDR photo, HDR video, Slow motion video, Face tagging, Face retouch, Intelligent scene detection","No","0","0.0","","No","0.0","","No","Any","Any","L sensor, P sensor, FP sensor","No","Non-standard protection","Non-standard protection","","","","No","Li-ion","built-in","","1","0","4000","0","","0","4000","0","0","","","","0","","","No","0","Japan, Australia","Asia, Australia","Vodafone Australia","","No","motorola_moto_g8_2.jpg","Final","2021-03-04 21:48","18129"
"Nokia","5.4 2021 LTE LATAM 64GB","","HMD 5.4","TA-1340","Single SIM variant for Latin America","2021 Jan","2020 Dec 16","HMD Global","FIH Precision Electronics","","Haptic touch feedback","Smartphone","","75.99","2.99","160.97","6.34","8.7","0.34","","106.4","181","6.38","Android","Google Android 11 (R)","","","Voice Command, Navigation software, Augmented Reality (AR), Intelligent personal assistant, Face Recognition","2000","Qualcomm Snapdragon 662 SM6115","LPDDR4x SDRAM","1804","4096","","","Flash EEPROM","Any","","61035","","","No","","","","","1","162.3","6.4","720x1560","1123200","68.01","2.68","147.36","5.8","7.98","10022.5","81.9","0.09446","269","Color IPS TFT LCD","No","24","16.8M","8","LED","Any","RGB Matrix","","Gorilla Glass 3","","","","","","","","","","","","","No","No","","","","No","No","No","No","Qualcomm Adreno 610","","950","","No","No","No","No","No","stereo","","","","stereo","No","","","mono","","3.5mm","GSM850, GSM900, GSM1800, GSM1900, UMTS850 (B5), UMTS900 (B8), UMTS1700/2100 (B4), UMTS1900 (B2), UMTS2100 (B1), LTE2100 (B1), LTE700 (B17), LTE700 (B13), LTE1700/2100 (B4), LTE850 (B5), LTE1800 (B3), LTE2600 (B7), LTE1900 (B2), LTE900 (B8), LTE700 (B12), LTE700 (B28), LTE1700/2100 (B66)","GPRS, GPRS MSC33, EDGE, EDGE MSC33, UMTS, HSDPA, HSPA+ 21.1, DC-HSDPA 42.2, HSUPA, HSUPA 5.8, LTE, LTE 100/50, LTE 150/50","Nano-SIM (4FF)","Internal antenna","64","No","Voice transmission, Voice speaker, Vibrate, Speakerphone, ANC, HD Voice, VoLTE","Qualcomm SM6115","0.43","US","UMTS850 (B5)","0.95","US","UMTS1900 (B2)","1.15","US","UMTS1700/2100 (B4)","0.41","US","GSM850","0.81","US","GSM1900","No","No","No","No","No","","Capacitive multi-touch","Any","","No","No","No","No","","No","No","","No","No","microSD, microSDHC, TransFlash, microSDXC","USB 2.0","USB HS (480 Mbps)","USB Host, USB OTG 1.3, USB charging","USB C reversible","10","No","No","No","No","No","No","No","No","Bluetooth 4.2","A2DP, AVRCP, HFP, HID, HSP, OPP, PAN, PBA, A2DP aptX","","802.11b, 802.11g, 802.11n, 802.11ac","Wi-Fi Direct, Wi-Fi Tethering, Wi-Fi Calling","","No","Unknown","No","No","No","FM radio (76-108 MHz) with RDS","Proprietary headset","No","No","No","GPS","","Internal antenna","A-GPS, QuickGPS, Geotagging, Simultaneous GPS","Any","No","BeiDou-2","Qualcomm SM6115","Rear","","BSI CMOS","","0.8","8000x6000","48.0","f/1.80","","1","8","PD AF","","","JPG","1920x1080","30","MPEG4","single LED","Face detection, Touch focus, Panorama Photo, HDR photo, Red-eye reduction, Face tagging, Burst mode, Intelligent scene detection, Pixel unification","","BSI CMOS","","0","4.9","","","No","Face detection, HDR photo, Face tagging, Burst mode, Intelligent scene detection","CMOS","0","","1.9","","","No","Macro mode, HDR photo, Burst mode","CMOS","0","1.9","","","No","No","No","0.0","0","","No","No","Front","","CMOS","","0","4608x3456","15.9","f/2.00","No","","JPG","1920x1080","30","3GP","No","Face detection, Smile detection, Panorama Photo, HDR photo, Face tagging, Face retouch, Burst mode","No","0","0.0","","No","0.0","","No","Any","Any","L sensor, P sensor, FP sensor","No","Any","Any","","","","No","Li-ion","built-in","","1","0","4000","0","","0","4000","0","0","","","","0","","","No","0","Mexico, Chile","North America, South America","AT&T Mexico Mobility, TELCEL","","No","nokia_54_2021.jpg","Preliminary","2020-12-21 09:42","17832"
